251,Carlisle,837 Owen overpass Port Lydia CA2 4BS,00220-63-79-17,64-66 : Finance & insurance,"Fox-Stone, Cook, Brown-Cooke, Scott, Williams, Smith, Newman",1.1 - Public Company (incl. Building Society),"Fox-Stone, Cook, Brown-Cooke, Scott and Sons Inc",20000251,0-632k,0-4 People,1,22-02-2015,1,07-07-2021,"[[5987, 25]]","[[5987, 25], [4671, 75]]",N/A,N/A,United Kingdom,United Kingdom,0,,,,,,,,,,,,,,,,,,,,,,,,
252,Buckinghamshire,77 Maureen hill East Jamie SL7 1QF,+440459 765682,"69-75 : Professional, scientific & technical","Scott-Roberts, Baker, Jones, Chamberlain, O'Sullivan-Walton",1.1 - Public Company (incl. Building Society),"Scott-Roberts, Baker, Jones, Chamberlain, Smith, Long, Connor, Wyatt LLC",20000252,0-632k,0-4 People,2,25-02-1996,1,31-07-2015,"[[5415, 75], [8992, 25]]","[[5415, 75], [8992, 25]]",N/A,N/A,United Kingdom,United Kingdom,0,143138,0.02,38998.89,38998.91,80014.142,0-632k,6666,-12891,47247,89709,29-09-2021,16680,-12890,21530,143138,,,,,,,,,
253,Gateshead,4 Tracey station North Antony NE8 4NL,+443691 224339,46 : Wholesale,"Walker-Williams, Brown-Holloway, Thornton-Rose, Thomas Carr, Simpson, Kirby",1.1 - Public Company (incl. Building Society),"Walker-Williams, Brown-Holloway, Thornton-Rose, Thomas Ltd",20000253,0-632k,0-4 People,2,10-01-2018,1,30-04-2020,"[[1529, 0], [6120, 75]]","[[6120, 75], [1496, 25]]",N/A,N/A,United Kingdom,United Kingdom,0,1240241,66.17,7971.74,8037.91,1231264.824,1M-10.2M,44173,79533,202901,113196,12-05-2021,24337,34508,21507,1240241,,,,,,,,,
254,Milton Keynes,812 Gary camp Port Nathanstad MK16 9ND,+44217 6239003,"69-75 : Professional, scientific & technical","Collier-Marsh, Roberts, Gordon-Jones, Robertson-Wall Parsons-Dixon",1.1 - Public Company (incl. Building Society),"Collier-Marsh, Roberts, Gordon-Jones, Robertson-Wall LLC",20000254,0-632k,0-4 People,1,29-08-2005,1,16-06-2014,"[[2223, 75]]","[[2223, 75], [2138, 25]]",N/A,N/A,United Kingdom,United Kingdom,1,56877,123.74,3566.03,3689.77,50066.39877,0-632k,2651,11744,24175,17826,10-12-2021,6731,1335,2674,56877,,,,,,,,,
255,Enfield,Studio 07 Guy cape EN1 3QA,+445903 017011,49-53 : Transport & Storage (inc. postal),"Marshall, Nelson, Newton, Phillips, Moran, Cooper, Talbot",1.1 - Public Company (incl. Building Society),"Marshall, Nelson, Newton, Phillips, Duncan, Moore, Gilbert-Richards, Moore PLC",20000255,0-632k,0-4 People,1,28-02-2014,1,31-12-2020,"[[7365, 75]]","[[7365, 75], [6617, 25]]",N/A,N/A,United Kingdom,United Kingdom,0,216667,304.67,3972.17,4276.84,210209.2346,0-632k,5342,40460,121604,88401,26-05-2021,17914,10656,13260,216667,,,,,,,,,
256,Northumberland,2 Carolyn shore Jonesview NE62 5HX,(0429) 5674084,"01-03 : Agriculture, forestry & fishing","Mills, Harris, Hall, Baker, Lawrence-Lawrence",3 - Partnership,"Mills, Harris, Hall, Baker, Jones, Howells, Thomas, Payne LP",20000256,0-632k,0-4 People,1,29-10-2018,1,21-05-2021,"[[4371, 50]]","[[4371, 50], [9558, 50]]",N/A,N/A,United Kingdom,United Kingdom,1,185230,370.35,3357.65,3728,179060.1265,0-632k,13193,167130,96935,58774,03-05-2021,201512,72543,6465,185230,,,,,,,,,
257,Rochdale,Studio 05 Lawson dam OL11 5HQ,+44(0)704 7564689,55-56 : Accommodation & food services,"Howe-Foster, Austin-Ryan, Williams, Savage, Carter",3 - Partnership,"Howe-Foster, Austin-Ryan, Williams, Savage, Haynes, Edwards-Parry LP",20000257,0-632k,0-4 People,1,24-09-2011,1,30-12-2019,"[[4380, 0]]","[[1031, 100]]",N/A,N/A,United Kingdom,United Kingdom,0,161973,0.03,10588.5,10588.53,19112.814,0-632k,4438,2806,57354,56978,01-05-2021,5237,2807,11395,161973,,,,,,,,,
258,Greenwich,Studio 5 Georgia manors SE9 3EE,(0472) 3064667,86-88 : Health,"Lord, Slater, Holmes, Richardson, Gray",2 - Sole Proprietor,"Lord, Slater, Holmes, Richardson, Carr-Bennett, Wood",20000258,0-632k,0-4 People,1,15-11-2019,1,14-05-2021,"[[51, 100]]","[[51, 100]]",N/A,N/A,United Kingdom,United Kingdom,0,152144,111.1,1821.23,1932.33,147404.9219,0-632k,7091,23710,53110,41577,08-02-2021,12750,574,5405,152144,,,,,,,,,
259,Westminster,Flat 0 Lewis coves W1H 1DE,(0696) 6888736,"69-75 : Professional, scientific & technical","Bates, Cunningham, Evans-Barrett, Young Ross",1.1 - Public Company (incl. Building Society),"Bates, Cunningham, Evans-Barrett, Young Ltd",20000259,0-632k,5-9 People,3,14-03-1953,1,12-10-2001,"[[6128, 50], [970, 50], [3815, 0]]","[[6128, 50], [970, 50]]",N/A,N/A,United Kingdom,United Kingdom,1,964054,74.28,2824.37,2898.65,957584.9926,632k-1M,44895,174962,369263,278787,17-11-2021,91164,6678,44605,964054,,,,,,,,,
260,Hastings,Flat 18g Amelia point TN37 6LU,+449144 37 96 84,"69-75 : Professional, scientific & technical","Graham-Walker, Franklin-Oliver, Reed, Wright-Howard Myers-Brown",1.1 - Public Company (incl. Building Society),"Graham-Walker, Franklin-Oliver, Reed, Wright-Howard Co",20000260,0-632k,0-4 People,1,24-01-2013,1,24-09-2018,"[[4096, 25]]","[[4096, 25], [5487, 75]]",N/A,N/A,United Kingdom,United Kingdom,0,183888,114.15,3977.28,4091.43,174586.5935,0-632k,8567,14507,59216,48789,14-05-2021,18589,14508,4878,183888,,,,,,,,,
261,Sheffield,Studio 5 Holly drives S6 6FX,(0701) 2642170,49-53 : Transport & Storage (inc. postal),"Dean-Watson, Dunn-Scott, Morris-Burke, Smith, Doherty",1.1 - Public Company (incl. Building Society),"Dean-Watson, Dunn-Scott, Morris-Burke, Smith, Pratt and Dodd LLC",20000261,0-632k,5-9 People,3,08-03-2014,1,08-08-2021,"[[7365, 0], [1984, 25], [8056, 0]]","[[1984, 25], [4006, 75]]",N/A,N/A,United Kingdom,United Kingdom,0,909377,447.34,6086.25,6533.59,899541.4337,632k-1M,22425,156883,466321,332287,01-04-2021,74654,51805,76426,909377,,,,,,,,,
262,Wiltshire,Flat 0 Hall lake BA12 7DP,+440573 535903,47 : Retail,"Ali, Lyons-Owen, Fisher, Thomson, Wong",1.1 - Public Company (incl. Building Society),"Ali, Lyons-Owen, Fisher, Thomson, Clayton, Khan PLC",20000262,632k-10.2M,0-4 People,1,26-07-2011,1,03-05-2016,"[[4366, 100]]","[[4366, 100]]",N/A,N/A,United Kingdom,United Kingdom,0,260187,0.02,264.45,264.47,520.374,0-632k,6412,4768,39420,31680,26-05-2021,1797,4769,7920,260187,,,,,,,,,
263,Redbridge,Studio 77 Moore divide IG1 2LS,02656-22-11-25,"90-99 : Arts, entertainment, recreation & other","Lewis-Nash, Brown, Bartlett-Hill, Stanley, Dickinson, Metcalfe, Brown",2 - Sole Proprietor,"Lewis-Nash, Brown, Bartlett-Hill, Stanley, Harvey and Murray",20000263,0-632k,0-4 People,1,14-11-2018,1,08-10-2021,"[[8783, 0]]","[[4192, 100]]",N/A,N/A,United Kingdom,United Kingdom,0,134991,0.01,9502.66,9502.67,29293.047,0-632k,6286,2667,41769,50978,25-12-2021,14544,2669,9685,134991,,,,,,,,,
264,Richmondshire,28 Dean freeway Marianfort DL8 3AT,+449958 775228,45 : Motor trades,"Murphy, Smith-Farrell, Gordon-Turner, Smith-Jones Gough, Burns, Smith",3 - Partnership,"Murphy, Smith-Farrell, Gordon-Turner, Smith-Jones LLP",20000264,0-632k,0-4 People,2,23-03-2005,1,18-11-2012,"[[823, 0], [1794, 50]]","[[1794, 50], [3001, 50]]",N/A,N/A,United Kingdom,United Kingdom,0,388758,33.57,2844.53,2878.1,385584.7228,0-632k,10650,87675,227644,202637,16-09-2021,85483,22814,44580,388758,,,,,,,,,
265,Cheshire East,622 Hugh courts Lake Daniel SK10 3JX,+44545 6542189,"69-75 : Professional, scientific & technical","Gibbs, Dawson, Kennedy, Jones, Riley-Fisher",1.1 - Public Company (incl. Building Society),"Gibbs, Dawson, Kennedy, Jones, Rose, Holmes-Wall LLC",20000265,0-632k,0-4 People,1,01-08-2016,1,24-03-2019,"[[4995, 0]]","[[8783, 100]]",N/A,N/A,United Kingdom,United Kingdom,1,153117,0.02,92679.12,92679.14,203645.61,0-632k,7135,11979,54557,46183,06-03-2021,15585,11980,8312,153117,,,,,,,,,
266,Dacorum,9 Akhtar brook South Danny HP4 3PD,+44(0)038 8387217,68 : Property,"Campbell-Jackson, Smith-Shah, Ryan, Goddard, Russell",3 - Partnership,"Campbell-Jackson, Smith-Shah, Ryan, Goddard, Bennett and Parry LP",20000266,0-632k,0-4 People,1,04-07-1992,1,17-08-2008,"[[4453, 50]]","[[4453, 50], [9477, 50]]",N/A,N/A,United Kingdom,United Kingdom,1,421541,222.77,2377.44,2600.21,413988.7625,0-632k,15013,765010,272003,248547,02-05-2021,1428019,686465,27340,421541,,,,,,,,,
267,Tamworth,Flat 44c Evans spring B79 8DQ,00526 27 98 97,41-43 : Construction,"Clark-Lewis, Smith, Sanderson, Green, Watson",1.1 - Public Company (incl. Building Society),"Clark-Lewis, Smith, Sanderson, Green, Kemp, Jones, Bradley and Ellis PLC",20000267,0-632k,0-4 People,1,31-05-1932,1,14-06-2005,"[[3812, 100]]","[[3812, 100]]",N/A,N/A,United Kingdom,United Kingdom,0,345191,206.58,6075.96,6282.54,334423.7498,0-632k,14187,45331,98478,46643,07-05-2021,9454,15958,8862,345191,,,,,,,,,
268,Tewkesbury,0 Wilson roads Callumfurt GL51 4SW,+44(0)028 740 4309,"69-75 : Professional, scientific & technical","Anderson, James, Oliver, Hale, Harrison, Allen, Knight",1.1 - Public Company (incl. Building Society),"Anderson, James, Oliver, Hale, Fleming, Mahmood, Walker, Warner Co",20000268,0-632k,0-4 People,1,21-10-1975,1,22-03-2003,"[[7149, 100]]","[[7149, 100]]",N/A,N/A,United Kingdom,United Kingdom,0,187406,99.84,3604.21,3704.05,178532.9975,0-632k,8729,10375,67420,61729,31-05-2021,15061,10376,9876,187406,,,,,,,,,
269,Rother,Studio 7 Garry highway TN40 2RY,+44(0)162 5713259,"90-99 : Arts, entertainment, recreation & other","Bryant, Chambers, Wilson, Shaw-Smith, Morgan, Campbell, Brooks",1.1 - Public Company (incl. Building Society),"Bryant, Chambers, Wilson, Shaw-Smith, Edwards-Harper, Bibi-Hodgson Ltd",20000269,0-632k,0-4 People,1,23-08-2017,1,14-02-2021,"[[9578, 25]]","[[9578, 25], [8695, 75]]",N/A,N/A,United Kingdom,United Kingdom,0,142823,98.31,3575.01,3673.32,135946.6638,0-632k,6652,-1749,43675,58498,07-05-2021,11325,-1747,9359,142823,,,,,,,,,
270,Middlesbrough,899 Andrews light Port Jayne TS5 4BW,09594 22042,77-82 : Business administration & support services,"Jones-Harrison, Harris, Kirby, Robson, Ferguson, Watson, Clarke",2 - Sole Proprietor,"Jones-Harrison, Harris, Kirby, Robson, Smith, Hall, Burns, James, Watson and Browne",20000270,0-632k,0-4 People,2,25-07-2015,1,27-02-2019,"[[3815, 0], [3987, 0]]","[[5967, 100]]",N/A,N/A,United Kingdom,United Kingdom,1,322324,167.53,3029.52,3197.05,315703.5479,0-632k,15012,48320,106819,68401,31-08-2021,27402,17501,8892,322324,,,,,,,,,
271,Waltham Forest,2 Frank courts Connorhaven E10 5GN,+441538 362523,77-82 : Business administration & support services,"Moss-Morgan, Hyde-Smith, James, Davis, Reid, Harrison, Brookes",1.1 - Public Company (incl. Building Society),"Moss-Morgan, Hyde-Smith, James, Davis, Sharpe, Ahmed-Townsend LLC",20000271,0-632k,0-4 People,1,21-09-2013,1,08-03-2019,"[[1880, 50]]","[[1880, 50], [1516, 50]]",N/A,N/A,United Kingdom,United Kingdom,0,322907,0.03,94288.33,94288.36,164036.756,0-632k,15046,54513,121909,86450,23-05-2021,29515,10462,20748,322907,,,,,,,,,
272,Bolton,Studio 4 Mitchell bypass BL4 8ND,+44(0)1782098688,77-82 : Business administration & support services,"Gill, Gray-Newton, Evans, Jones, Carroll, Brown, Osborne",1.1 - Public Company (incl. Building Society),"Gill, Gray-Newton, Evans, Jones, Moss and Ali Co",20000272,0-632k,0-4 People,2,03-06-1984,1,27-08-2007,"[[8684, 0], [5542, 0]]","[[8474, 100]]",N/A,N/A,United Kingdom,United Kingdom,1,396085,138.91,2943.1,3082.01,390310.8287,0-632k,18447,67667,148184,98628,08-03-2021,39780,21669,22684,396085,,,,,,,,,
273,Birmingham,Studio 07z Clive junction B75 5HW,(0214)9086589,47 : Retail,"Shaw, Hunter, Howard, Evans, Edwards-Powell",1.1 - Public Company (incl. Building Society),"Shaw, Hunter, Howard, Evans, Hicks, Collier, Poole-Shah, Walker-Bell Co",20000273,0-632k,0-4 People,1,05-10-2017,1,25-10-2021,"[[1636, 25]]","[[1636, 25], [752, 75]]",N/A,N/A,United Kingdom,United Kingdom,0,252216,267.88,9884.71,10152.59,241620.32,0-632k,6215,5688,43663,33800,24-04-2021,1514,5689,3718,252216,,,,,,,,,
274,Eden,8 George inlet West Derek CA11 0PE,+447715 94 72 66,77-82 : Business administration & support services,"Black, Connor, O'Sullivan, Vaughan-Robinson, Bishop, Smith, Morris",1.1 - Public Company (incl. Building Society),"Black, Connor, O'Sullivan, Vaughan-Robinson, Anderson, King, Davies, Stewart PLC",20000274,0-632k,5-9 People,1,19-02-2008,1,26-01-2021,"[[8359, 75]]","[[8359, 75], [167, 25]]",N/A,N/A,United Kingdom,United Kingdom,0,1217202,0.02,28088.15,28088.17,73032.12,1M-10.2M,56692,187549,406585,262376,07-05-2021,114384,71044,44604,1217202,,,,,,,,,
275,Cotswold,Flat 46R Samantha summit GL7 4DX,+44(0)1415974987,"01-03 : Agriculture, forestry & fishing","Foster, Miller, Lowe, Booth-King, Smith, Dixon, Rees",2 - Sole Proprietor,"Foster, Miller, Lowe, Booth-King, Williams, Hicks",20000275,0-632k,0-4 People,1,21-09-1999,1,26-07-2009,"[[4226, 100]]","[[4226, 100]]",N/A,N/A,United Kingdom,United Kingdom,0,198727,343.79,3455.16,3798.95,192876.7408,0-632k,14154,210006,28800,16927,05-05-2021,346211,148078,4062,198727,,,,,,,,,
276,Harrow,Studio 4 Wendy burg HA7 4RD,748068802,58-63 : Information & communication,"James-Whitehouse, Moore-Reynolds, Barber, Barnes, Phillips, Ellis, Cole",1.1 - Public Company (incl. Building Society),"James-Whitehouse, Moore-Reynolds, Barber, Barnes, Brown, Evans, Booth and Kelly PLC",20000276,0-632k,0-4 People,3,18-01-2019,1,23-01-2021,"[[894, 0], [2425, 0], [3987, 0]]","[[6281, 100]]",N/A,N/A,United Kingdom,United Kingdom,0,214324,0.03,56806.58,56806.61,101803.9,0-632k,7045,20420,125605,100882,10-10-2021,16119,20422,25220,214324,,,,,,,,,
277,South Gloucestershire,84 Williams plaza Dominicfurt GL9 1BB,8845933931,41-43 : Construction,"Cartwright, King-Holland, Lord, Yates, Carr, Hamilton, West",2 - Sole Proprietor,"Cartwright, King-Holland, Lord, Yates, Norris, Pearson, Walsh and Fry",20000277,0-632k,0-4 People,1,15-08-2012,0,08-12-2020,"[[1778, 0]]","[[3698, 100]]",N/A,N/A,United Kingdom,United Kingdom,0,370951,94.21,3438.41,3532.62,364695.9318,0-632k,15245,33147,69987,31567,18-05-2021,8933,14207,5366,370951,,,,,,,,,
278,Islington,Studio 60V Stanley avenue N5 2RZ,+44(0)1278371445,"90-99 : Arts, entertainment, recreation & other","Begum, Schofield, Gordon, Doyle-Clark, Richards-Hill",1.1 - Public Company (incl. Building Society),"Begum, Schofield, Gordon, Doyle-Clark, Lawson, Rogers, Jones, Patel-Elliott Inc",20000278,0-632k,0-4 People,2,28-01-2007,1,09-02-2018,"[[2546, 25], [2050, 25]]","[[2546, 25], [2050, 25], [7342, 50]]",N/A,N/A,United Kingdom,United Kingdom,0,139595,0.01,57421.12,57421.13,116143.04,0-632k,6501,-4313,45979,66592,28-04-2021,11987,-4311,13984,139595,,,,,,,,,
279,Wirral,Flat 77T Louis plain CH62 7JN,+44(0)542 495 7665,58-63 : Information & communication,"Page-Thompson, Atkinson, Singh, Parkin, May",1.1 - Public Company (incl. Building Society),"Page-Thompson, Atkinson, Singh, Parkin, Black, Turner, Roberts and Martin Ltd",20000279,0-632k,0-4 People,1,04-08-2019,1,27-11-2021,"[[894, 75]]","[[894, 75], [2135, 25]]",N/A,N/A,United Kingdom,United Kingdom,0,202817,0.03,51155.96,51155.99,120878.932,0-632k,6667,15456,123423,106372,30-04-2021,13863,15458,20210,202817,,,,,,,,,
280,Lichfield,2 Jade prairie Hudsonton WS7 9DE,4.41617E+11,41-43 : Construction,"Frost, Williams, Jones, Burton, Wilkinson",1.1 - Public Company (incl. Building Society),"Frost, Williams, Jones, Burton, Lambert, Jones, Hart, Chapman-Moore Inc",20000280,0-632k,0-4 People,1,04-12-2014,0,09-12-2020,"[[315, 0]]","[[5202, 100]]",N/A,N/A,United Kingdom,United Kingdom,1,314881,0.01,105447.38,105447.39,235216.107,0-632k,12939,41900,88709,43718,20-12-2021,11053,14144,6120,314881,,,,,,,,,
281,Doncaster,Studio 16 Jonathan motorway DN2 5SP,05738 02 35 57,77-82 : Business administration & support services,"Miller, Clarke-Williams, Kaur, Davison, Robinson",2 - Sole Proprietor,"Miller, Clarke-Williams, Kaur, Davison, Wong and Smith",20000281,0-632k,0-4 People,1,03-06-2013,1,17-08-2017,"[[4398, 0]]","[[2436, 100]]",N/A,N/A,United Kingdom,United Kingdom,1,258634,0.02,76532.9,76532.92,243115.96,0-632k,12045,39442,85795,54310,15-12-2021,23766,15809,11948,258634,,,,,,,,,
282,Caerphilly,717 Murray fords East Joeborough NP11 5LF,04043 082211,86-88 : Health,"Burns, Harvey, Smith, Khan-Smith, White",2 - Sole Proprietor,"Burns, Harvey, Smith, Khan-Smith, Morgan, Lane-Richards",20000282,632k-10.2M,10-19 People,1,06-02-1983,1,01-05-2001,"[[51, 100]]","[[51, 100]]",N/A,N/A,United Kingdom,United Kingdom,0,612115,1580.27,18925.42,20505.69,568638.2789,0-632k,28509,88021,192757,128230,25-05-2021,51746,28252,29492,612115,,,,,,,,,
283,Cornwall,506 Gareth mountain Harrisside TR5 0UW,03376 92492,77-82 : Business administration & support services,"Marshall, Townsend, Taylor, Allen, Read",1.1 - Public Company (incl. Building Society),"Marshall, Townsend, Taylor, Allen, Matthews, Kirk, Smith-Barker, Morgan and Sons Ltd",20000283,0-632k,0-4 People,1,06-02-1990,1,01-12-2005,"[[3129, 0]]","[[2418, 100]]",N/A,N/A,United Kingdom,United Kingdom,0,316679,174.3,3270.19,3444.49,308525.9508,0-632k,14747,48711,103220,53655,20-05-2021,32090,32943,11804,316679,,,,,,,,,
284,Hillingdon,Studio 2 Arthur lakes HA5 2EN,+44424 7780781,"69-75 : Professional, scientific & technical","Jones-Gray, Glover, Roberts, Whitehead, Mann",1.1 - Public Company (incl. Building Society),"Jones-Gray, Glover, Roberts, Whitehead, Allen, Saunders-Taylor Inc",20000284,0-632k,5-9 People,1,23-10-2019,1,14-03-2021,"[[9228, 25]]","[[9228, 25], [287, 75]]",N/A,N/A,United Kingdom,United Kingdom,0,1084736,216.59,6153.21,6369.8,1071356.546,1M-10.2M,50522,62801,327559,299378,14-05-2021,97423,62802,71850,1084736,,,,,,,,,
285,Bradford,Flat 66 Mitchell prairie BD3 0QD,(0174)8977047,55-56 : Accommodation & food services,"Evans-Jones, Griffiths, Walker, Cox, Griffiths-Rees",2 - Sole Proprietor,"Evans-Jones, Griffiths, Walker, Cox, Pearson, Carter-Jackson",20000285,0-632k,0-4 People,1,14-01-2013,1,31-01-2017,"[[0, 100]]","[[0, 100]]",N/A,N/A,United Kingdom,United Kingdom,1,129693,0.03,60828.14,60828.17,182996.823,0-632k,3552,2558,48503,48534,02-12-2020,5150,2560,7280,129693,,,,,,,,,
286,Cheltenham,Flat 38 Gregory hill GL51 7TN,+44(0)9448150451,47 : Retail,"Mitchell, Evans, Osborne, Charlton, Winter-Humphries",1.1 - Public Company (incl. Building Society),"Mitchell, Evans, Osborne, Charlton, Forster, Jackson-Francis Inc",20000286,0-632k,5-9 People,1,11-09-2007,1,18-08-2015,"[[8214, 50]]","[[8214, 50], [934, 50]]",N/A,N/A,United Kingdom,United Kingdom,1,881183,373.89,10473.14,10847.03,869699.2903,632k-1M,21727,54063,144494,90472,22-05-2021,5682,5641,22618,881183,,,,,,,,,
287,Leeds,Studio 7 Cross ford LS9 7PP,+447027 396410,55-56 : Accommodation & food services,"Arnold-Martin, Matthews, Smith, Cooper, Williamson, Hamilton, Taylor",1.1 - Public Company (incl. Building Society),"Arnold-Martin, Matthews, Smith, Cooper, Fry, Kemp, Marshall, Jones, Burke and Thomas PLC",20000287,0-632k,0-4 People,1,03-10-1981,0,10-05-2002,"[[4033, 75]]","[[4033, 75], [5397, 25]]",N/A,N/A,United Kingdom,United Kingdom,0,135673,0.02,63874.71,63874.73,172169.037,0-632k,3717,-6424,58816,77646,14-04-2021,5982,-6422,10094,135673,,,,,,,,,
288,Stroud,79 Rosie lodge West Dorothyberg GL6 0BJ,+44(0)445 6038502,"01-03 : Agriculture, forestry & fishing","Phillips, Waters, Little, Taylor-Chapman, Jordan, Miller, Lee",2 - Sole Proprietor,"Phillips, Waters, Little, Taylor-Chapman, Conway, Goddard, Phillips, Brown",20000288,0-632k,0-4 People,1,01-11-2018,1,16-08-2021,"[[5047, 100]]","[[5047, 100]]",N/A,N/A,United Kingdom,United Kingdom,0,212905,640.64,5689.52,6330.16,204467.3338,0-632k,15167,287290,61562,35868,30-04-2021,451456,189859,5380,212905,,,,,,,,,
289,Sutton,Flat 40q Whittaker point SM6 8RA,06161 03755,41-43 : Construction,"Brooks, Farmer, Adams, Cole, White",2 - Sole Proprietor,"Brooks, Farmer, Adams, Cole, Jones-Murphy, Taylor-Talbot",20000289,0-632k,0-4 People,1,02-12-2019,1,23-02-2021,"[[4331, 100]]","[[4331, 100]]",N/A,N/A,United Kingdom,United Kingdom,0,298689,214.13,6316.48,6530.61,290097.4923,0-632k,12274,29464,63152,36367,06-05-2021,7001,4321,6546,298689,,,,,,,,,
290,Derbyshire Dales,7 Bradley shoals Lake Josephshire DE4 2BZ,+44(0)542 024 8715,"69-75 : Professional, scientific & technical","Jackson, Sykes-Walters, Miller, Owen, Campbell, Mason, Thompson",1.1 - Public Company (incl. Building Society),"Jackson, Sykes-Walters, Miller, Owen, Jenkins, Allen-Phillips PLC",20000290,0-632k,0-4 People,1,08-09-1989,1,21-05-2009,"[[8684, 0]]","[[809, 100]]",N/A,N/A,United Kingdom,United Kingdom,1,181110,0.01,64947.49,64947.5,168432.3,0-632k,8434,24097,47119,34060,28-05-2021,16295,5257,7833,181110,,,,,,,,,
291,Shropshire,Flat 10W Debra shores SY7 8NU,+447189 63 15 65,"01-03 : Agriculture, forestry & fishing","Page, Scott-Wilson, Hart-Bailey, Dennis-Smith Hawkins, Cole, Jones",3 - Partnership,"Page, Scott-Wilson, Hart-Bailey, Dennis-Smith LLP",20000291,0-632k,0-4 People,2,10-03-2019,0,01-03-2020,"[[344, 75], [1787, 25]]","[[344, 75], [1787, 25]]",N/A,N/A,United Kingdom,United Kingdom,0,71094,626.26,4869.81,5496.07,61903.95132,0-632k,5062,118638,28812,17172,28-04-2021,183042,76043,3778,71094,,,,,,,,,
292,Islington,8 Lawrence ports Port David N1 2GA,+449993 37 78 31,64-66 : Finance & insurance,"Mitchell, Carter, Begum, Lee-Bradley, Doyle",1.1 - Public Company (incl. Building Society),"Mitchell, Carter, Begum, Lee-Bradley, Walker, Edwards, Jones, Price-Parker PLC",20000292,632k-10.2M,0-4 People,1,06-08-2005,1,08-01-2015,"[[5231, 100]]","[[5231, 100]]",N/A,N/A,United Kingdom,United Kingdom,1,,,,,,,,,,,,,,,,,,,,,,,,
293,West Berkshire,7 Linda ferry Bennettland RG17 8YQ,+44(0)4774213029,05-39 : Production,"Owen, Peters, Lewis, Young, Hutchinson",1.1 - Public Company (incl. Building Society),"Owen, Peters, Lewis, Young, Kirk, Turner PLC",20000293,0-632k,5-9 People,1,08-07-2015,1,28-02-2021,"[[5534, 0]]","[[8029, 100]]",N/A,N/A,United Kingdom,United Kingdom,1,567962,0.02,231233.57,231233.59,498670.636,0-632k,17113,123342,126395,151881,24-04-2021,259050,110221,36451,567962,,,,,,,,,
294,Folkestone and Hythe,Studio 0 Richard club CT21 6PP,07249 16 87 74,58-63 : Information & communication,"Thomson, Mann, Bryant, Bell, King, King, Smith",1.1 - Public Company (incl. Building Society),"Thomson, Mann, Bryant, Bell, Mills-Herbert, Roberts, Gallagher and Evans Inc",20000294,0-632k,0-4 People,1,18-06-2013,1,19-11-2019,"[[3987, 100]]","[[3987, 100]]",N/A,N/A,United Kingdom,United Kingdom,0,151612,208.81,3824.44,4033.25,143656.0186,0-632k,4983,30282,88905,67792,08-05-2021,12036,2866,6779,151612,,,,,,,,,
295,West Lothian,Flat 23n Georgia forks EH47 0PN,06188-40-01-22,41-43 : Construction,"Todd, Elliott, Kent, Harrison, Lloyd-Wood",2 - Sole Proprietor,"Todd, Elliott, Kent, Harrison, Kaur, Gill, Byrne, Walsh, Lloyd and Hughes",20000295,0-632k,0-4 People,1,07-01-2019,1,07-10-2021,"[[8317, 100]]","[[8317, 100]]",N/A,N/A,United Kingdom,United Kingdom,1,345453,55.55,2161.45,2217,341329.6628,0-632k,14198,35877,75222,35781,16-05-2021,10199,13763,3935,345453,,,,,,,,,
296,Chelmsford,834 Wright light Oliviamouth SS11 7BH,+447201 251613,41-43 : Construction,"Harris-Knight, Wright, Robinson-Murphy, Pollard, Griffiths",1.1 - Public Company (incl. Building Society),"Harris-Knight, Wright, Robinson-Murphy, Pollard, Wilson and Sullivan PLC",20000296,0-632k,5-9 People,1,01-08-2017,1,06-03-2021,"[[257, 0]]","[[3186, 100]]",N/A,N/A,United Kingdom,United Kingdom,1,1247977,189.5,7316.56,7506.06,1236755.279,1M-10.2M,51287,115256,249117,120525,05-05-2021,25301,38637,15668,1247977,,,,,,,,,
297,North Somerset,324 Murphy spring Akhtarview BS49 5BA,4.42744E+11,"90-99 : Arts, entertainment, recreation & other","Wilson, Smith, Bryan, Jones, Peacock, Shepherd, Wilkins",1.1 - Public Company (incl. Building Society),"Wilson, Smith, Bryan, Jones, Young-Dyer, Walker-Farmer PLC",20000297,0-632k,5-9 People,1,27-02-2004,1,27-06-2010,"[[8360, 50]]","[[8360, 50], [7776, 50]]",N/A,N/A,United Kingdom,United Kingdom,0,288222,141.24,5718.2,5859.44,276945.7164,0-632k,13427,-4490,101489,141409,29-05-2021,30941,-4488,26867,288222,,,,,,,,,
298,Crawley,Studio 37n James valley RH10 7GR,(0891)0292172,"69-75 : Professional, scientific & technical","Rogers-Harding, Parsons, Price, Houghton, Patel",2 - Sole Proprietor,"Rogers-Harding, Parsons, Price, Houghton, Metcalfe, Lee and Sons",20000298,0-632k,0-4 People,1,18-10-1963,1,17-10-2002,"[[8134, 100]]","[[8134, 100]]",N/A,N/A,United Kingdom,United Kingdom,0,213799,0.01,79614.36,79614.37,159707.853,0-632k,9958,11483,60089,53551,31-05-2021,16430,11485,8568,213799,,,,,,,,,
299,Thanet,113 George locks East Georginashire CT10 1TE,09680 08143,"69-75 : Professional, scientific & technical","Taylor, Robinson, Burton, Roberts-Hawkins, Finch, Fisher, Mason",2 - Sole Proprietor,"Taylor, Robinson, Burton, Roberts-Hawkins, Hall-Ashton, Taylor and Sons",20000299,0-632k,0-4 People,1,16-02-2015,1,22-12-2020,"[[3181, 100]]","[[3181, 100]]",N/A,N/A,United Kingdom,United Kingdom,0,153092,167.54,5252.01,5419.55,140713.9505,0-632k,7131,5263,36166,35864,04-05-2021,10226,5265,8966,153092,,,,,,,,,
300,North Somerset,38 Joe union New Pamela BS21 6NU,+44695 8088617,55-56 : Accommodation & food services,"Jones, Booth, Hawkins, Barnett, Williams-Hanson",7 - Non-profit Body or Mutual Association,"Jones, Booth, Hawkins, Barnett, Webb and Fry",20000300,0-632k,20-49 People,7,06-01-2012,1,14-05-2019,"[[4702, 100], [7216, 0], [5904, 0], [9621, 0], [6885, 0], [2318, 0], [8900, 0]]","[[4702, 100]]",N/A,N/A,United Kingdom,United Kingdom,0,1174807,6496.5,97253.03,103749.53,982341.08,1M-10.2M,32186,39497,597324,560044,26-05-2021,41716,39499,112008,1174807,,,,,,,,,
301,Gwynedd,73 Stuart mountains Lake Kateborough LL55 3LE,6361418018,46 : Wholesale,"Rose, Williams-Carter, Shaw, Baker-Hall Cooper",1.1 - Public Company (incl. Building Society),"Rose, Williams-Carter, Shaw, Baker-Hall Inc",20000301,0-632k,0-4 People,2,01-12-2007,1,09-09-2018,"[[8641, 100], [3030, 0]]","[[8641, 100]]",N/A,N/A,United Kingdom,United Kingdom,1,1746691,59.02,6415.02,6474.04,1737632.795,1M-10.2M,62207,102167,261117,139910,08-05-2021,30790,49829,34977,1746691,,,,,,,,,
