707,Rushmoor,9 Ford ridges South Debrafort GU11 3ER,+448677 35 28 46,41-43 : Construction,"Hussain, Akhtar, Kemp, Jones, Leonard",1.1 - Public Company (incl. Building Society),"Hussain, Akhtar, Kemp, Jones, Price-Pearson, Coates and Sons Inc",20000707,0-632k,0-4 People,2,05-08-2007,1,29-12-2018,"[[9592, 75], [6943, 25]]","[[9592, 75], [6943, 25]]",N/A,N/A,United Kingdom,United Kingdom,1,277496,0.01,314908.4,314908.41,869672.464,0-632k,11406,30195,63367,21907,29-05-2021,8526,19790,2409,277496,,,,,,,,,
708,Mendip,066 Owen streets Melissahaven BA11 5HA,+44(0)945 6932925,58-63 : Information & communication,"Phillips, Mann, Davies, Clark-Parker, Norman-Hancock",1.1 - Public Company (incl. Building Society),"Phillips, Mann, Davies, Clark-Parker, Harris-Brown, Mills PLC",20000708,0-632k,0-4 People,1,26-07-2002,0,10-09-2006,"[[724, 75]]","[[724, 75], [9340, 25]]",N/A,N/A,United Kingdom,United Kingdom,0,194405,209.08,3177.5,3386.58,187299.6683,0-632k,6392,38742,112691,88031,15-09-2021,16450,2367,12324,194405,,,,,,,,,
709,Ealing,57 Rachael streets West Ryanchester W13 0JU,+441656 269074,46 : Wholesale,"Bailey-Williams, Owen, Cameron, Cross, Gray",1.1 - Public Company (incl. Building Society),"Bailey-Williams, Owen, Cameron, Cross, Miller, Williams, Curtis, Wright-Abbott Co",20000709,0-632k,0-4 People,1,09-07-2007,1,08-10-2021,"[[5367, 100]]","[[5367, 100]]",N/A,N/A,United Kingdom,United Kingdom,0,1466008,0,189449.28,189449.28,532160.904,1M-10.2M,52214,81172,213301,119126,19-05-2021,18618,31621,25016,1466008,,,,,,,,,
710,Barnet,Studio 14Z Simpson harbors N10 2JL,+446004 056944,41-43 : Construction,"Gallagher-Wright, Smith, Nash, Jones, Mitchell",1.1 - Public Company (incl. Building Society),"Gallagher-Wright, Smith, Nash, Jones, Jones-Davies, Robertson Co",20000710,0-632k,0-4 People,1,30-01-2018,1,07-12-2018,"[[2057, 75]]","[[2057, 75], [702, 25]]",N/A,N/A,United Kingdom,United Kingdom,0,268722,132.17,3992.97,4125.14,262647.1866,0-632k,11044,31124,65287,30052,11-01-2021,8818,12928,7513,268722,,,,,,,,,
711,Wychavon,1 Julia vista Kaurshire WR8 9LN,03507-34-26-35,55-56 : Accommodation & food services,"Foster-Harper, Brown, Wood-Turner, Davies, Davies",1.1 - Public Company (incl. Building Society),"Foster-Harper, Brown, Wood-Turner, Davies, Herbert and Smart LLC",20000711,0-632k,0-4 People,1,05-11-2012,1,22-02-2020,"[[4884, 25]]","[[4884, 25], [9443, 75]]",N/A,N/A,United Kingdom,United Kingdom,0,140956,267.64,4073.65,4341.29,130497.3266,0-632k,3862,3462,50698,48683,22-04-2021,4911,3463,8763,140956,,,,,,,,,
712,Camden,0 Kathleen meadows Port Marian WC1X 0LS,09220 247144,41-43 : Construction,"Stanley-Jones, Barker, Slater, Wheeler, Berry",1.1 - Public Company (incl. Building Society),"Stanley-Jones, Barker, Slater, Wheeler, Bird, Gibbons-Howe PLC",20000712,0-632k,0-4 People,1,04-12-2020,1,18-01-2021,"[[3699, 50]]","[[3699, 50], [7965, 50]]",N/A,N/A,United Kingdom,United Kingdom,0,405316,111.69,3603,3714.69,398725.5441,0-632k,16657,26718,58195,28327,20-05-2021,5420,8569,2832,405316,,,,,,,,,
713,Basingstoke and Deane,Flat 03g Nicholas drives RG22 5HU,02367-56-19-76,49-53 : Transport & Storage (inc. postal),"Clarke, Chapman, Pollard, Smith, Owen-Holmes",2 - Sole Proprietor,"Clarke, Chapman, Pollard, Smith, Brown-Parkinson, Roberts, Johnson and Connolly",20000713,0-632k,5-9 People,1,18-05-1982,0,22-06-2001,"[[1496, 0]]","[[8204, 100]]",N/A,N/A,United Kingdom,United Kingdom,1,729989,566.31,7987.51,8553.82,718211.4804,632k-1M,18000,9387,405445,436003,22-02-2021,49334,9389,47960,729989,,,,,,,,,
714,Trafford,Flat 16 Hunt stream M33 3JT,06338-09-34-69,"90-99 : Arts, entertainment, recreation & other","Davies, Conway, Doherty, Lee, Harrison, Donnelly, Poole",2 - Sole Proprietor,"Davies, Conway, Doherty, Lee, Harrison, Smith-Rice",20000714,0-632k,5-9 People,1,03-07-2019,1,24-07-2021,"[[2620, 0]]","[[3487, 100]]",N/A,N/A,United Kingdom,United Kingdom,0,236255,241.56,8475.9,8717.46,224636.2133,0-632k,11003,-12467,69953,119526,28-04-2021,24639,-12465,22709,236255,,,,,,,,,
715,Buckinghamshire,Flat 62 White station MK18 4RQ,+447240 21 97 05,"90-99 : Arts, entertainment, recreation & other","Bishop, Foster, Ball, Frost, Harrison",1.1 - Public Company (incl. Building Society),"Bishop, Foster, Ball, Frost, Lewis-Butler, Payne-Stone PLC",20000715,0-632k,0-4 People,1,03-04-2020,1,23-02-2021,"[[4911, 100]]","[[4911, 100]]",N/A,N/A,United Kingdom,United Kingdom,0,172132,92.09,2970.77,3062.86,166519.3559,0-632k,8023,3009,52055,64327,15-06-2021,18293,3011,10935,172132,,,,,,,,,
716,West Suffolk,Flat 7 Hussain mount CB9 8WZ,01172-23-73-23,"69-75 : Professional, scientific & technical","Owen, Moss, Hicks, Burrows, Smith",1.1 - Public Company (incl. Building Society),"Owen, Moss, Hicks, Burrows, Robinson, Jackson, Clayton-Allen, Richardson Ltd",20000716,0-632k,0-4 People,1,03-04-2010,1,14-11-2019,"[[6825, 25]]","[[6825, 25], [225, 75]]",N/A,N/A,United Kingdom,United Kingdom,0,202996,0.01,56869.49,56869.5,127481.488,0-632k,9458,34350,72418,50402,25-12-2021,17978,5643,6048,202996,,,,,,,,,
717,South Kesteven,5 Andrews unions South Rickyfurt NG31 6DD,06112 45996,55-56 : Accommodation & food services,"Richards, Hill, Simpson, Barker, Collier, West, Harrison",2 - Sole Proprietor,"Richards, Hill, Simpson, Barker, Clayton, Martin",20000717,0-632k,0-4 People,2,19-07-2003,1,17-12-2013,"[[7256, 100], [986, 0]]","[[7256, 100]]",N/A,N/A,United Kingdom,United Kingdom,1,163653,186.02,3207.18,3393.2,157973.5512,0-632k,4485,6632,67949,59955,12-05-2021,5271,6633,9592,163653,,,,,,,,,
718,Hammersmith and Fulham,Studio 40o O'Brien centers W6 9PS,09745 89698,77-82 : Business administration & support services,"Humphries-Green, Gould-Harper, Smith, Akhtar Moss",1.1 - Public Company (incl. Building Society),"Humphries-Green, Gould-Harper, Smith, Akhtar Co",20000718,0-632k,0-4 People,2,04-03-2003,1,29-08-2021,"[[6651, 100], [8172, 0]]","[[6651, 100]]",N/A,N/A,United Kingdom,United Kingdom,0,352964,180.72,3636.18,3816.9,343638.0623,0-632k,16439,52495,114959,83838,01-05-2021,30861,9486,9222,352964,,,,,,,,,
719,Tower Hamlets,91 Gareth green Bibimouth E14 3TQ,+447473 88 00 84,77-82 : Business administration & support services,"Parsons, Booth, Richards, Barlow, Bennett-Savage",1.2.1 - Private Limited Company (incl. Building Society),"Parsons, Booth, Richards, Barlow, Barnes-Barrett, Martin, Holmes and Dawson LLC",20000719,0-632k,0-4 People,2,02-08-2007,1,13-12-2017,"[[8992, 0], [4096, 0]]","[[2192, 100]]",N/A,N/A,United Kingdom,United Kingdom,0,295624,247.33,4464.36,4711.69,286590.491,0-632k,13764,44150,99274,73760,14-05-2021,23365,4728,8113,295624,,,,,,,,,
720,Three Rivers,Flat 87 James summit WD3 3TT,7313142328,"69-75 : Professional, scientific & technical","Norman, Parker, Fletcher, Thomson-Smith, Coleman",1.1 - Public Company (incl. Building Society),"Norman, Parker, Fletcher, Thomson-Smith, Foster-Ross, Richardson-Richards Ltd",20000720,0-632k,0-4 People,1,16-07-2018,1,03-04-2021,"[[5231, 100]]","[[5231, 100]]",N/A,N/A,United Kingdom,United Kingdom,1,160285,89.69,2512.35,2602.04,154310.3357,0-632k,7467,25237,49641,33953,16-05-2021,16773,7224,5432,160285,,,,,,,,,
721,South Lanarkshire,632 Heather cliffs Conwayview G72 6AP,(0367)8127667,58-63 : Information & communication,"Bell, Phillips, Heath, Rowe Gibson",1.1 - Public Company (incl. Building Society),"Bell, Phillips, Heath, Rowe Inc",20000721,0-632k,0-4 People,1,13-04-2012,0,10-09-2021,"[[5231, 100]]","[[5231, 100]]",N/A,N/A,United Kingdom,United Kingdom,1,121215,281.34,5560.16,5841.5,112086.5172,0-632k,3984,25123,73813,55146,13-05-2021,9930,3474,8271,121215,,,,,,,,,
722,Wiltshire,Studio 89u Michelle keys SN13 9TB,+44(0)373 6089601,"01-03 : Agriculture, forestry & fishing","Singh-Stokes, Robinson, Greenwood, Glover, Smith-Owen",3 - Partnership,"Singh-Stokes, Robinson, Greenwood, Glover, Mitchell, Daly, Hooper and Vaughan LLP",20000722,632k-10.2M,0-4 People,1,30-09-2016,1,28-06-2021,"[[4371, 0]]","[[5047, 100]]",N/A,N/A,United Kingdom,United Kingdom,0,134501,0.07,6291.62,6291.69,10894.581,0-632k,9581,206830,108733,54036,21-05-2021,260606,108472,13509,134501,,,,,,,,,
723,Gwynedd,Studio 11r Gough parkway LL40 1ES,+44(0)503 249 6382,47 : Retail,"Freeman-Campbell, Clark-Mistry, Richardson, Buckley-Wall Shaw",3 - Partnership,"Freeman-Campbell, Clark-Mistry, Richardson, Buckley-Wall GP",20000723,0-632k,5-9 People,1,15-05-2016,1,09-06-2021,"[[6994, 75]]","[[6994, 75], [6484, 25]]",N/A,N/A,United Kingdom,United Kingdom,1,798553,207.42,6756.4,6963.82,789845.171,632k-1M,19690,2612,136337,136981,15-04-2021,5870,2614,16437,798553,,,,,,,,,
724,Birmingham,776 Duncan tunnel South Jasmineview B44 8BS,+44(0)356 6173925,85 : Education,"Wood-Wallis, Gallagher, Bell, Kent-Simpson Morgan",1.1 - Public Company (incl. Building Society),"Wood-Wallis, Gallagher, Bell, Kent-Simpson Co",20000724,0-632k,0-4 People,1,15-04-2005,1,24-07-2020,"[[4916, 0]]","[[1895, 100]]",N/A,N/A,United Kingdom,United Kingdom,0,189164,1024.42,6018.94,7043.36,178244.3044,0-632k,8809,23429,59165,48396,30-12-2020,18934,6272,9195,189164,,,,,,,,,
725,North Hertfordshire,2 Saunders islands North Tom SG4 7AH,+44(0)078 395 8715,"90-99 : Arts, entertainment, recreation & other","Walker, Nicholson, Hill, Lewis, Kelly-Shepherd",1.1 - Public Company (incl. Building Society),"Walker, Nicholson, Hill, Lewis, Mann, Quinn, Fletcher, Dyer Ltd",20000725,0-632k,0-4 People,1,20-08-2018,0,28-02-2021,"[[5571, 75]]","[[5571, 75], [7220, 25]]",N/A,N/A,United Kingdom,United Kingdom,0,131738,0.01,84340.64,84340.65,274278.516,0-632k,6132,2381,40413,49367,14-02-2021,13719,2383,11848,131738,,,,,,,,,
726,South Lanarkshire,Flat 6 Phillip hills G74 3HB,+44(0)590 540 1179,47 : Retail,"McDonald, Harris, Hodgson, Moran, Patel-Stephens",1.1 - Public Company (incl. Building Society),"McDonald, Harris, Hodgson, Moran, Williams, Wong, Johnson-Wood, Hall and Sons LLC",20000726,0-632k,0-4 People,2,15-05-2015,1,30-07-2021,"[[9350, 0], [4781, 0]]","[[2060, 100]]",N/A,N/A,United Kingdom,United Kingdom,0,274372,193.18,5925.91,6119.09,266155.2626,0-632k,6765,5727,46047,36499,22-05-2021,1910,5729,8029,274372,,,,,,,,,
727,Stroud,Flat 19 Lewis island GL5 4SJ,+44507 5256385,58-63 : Information & communication,"Shepherd, Talbot, Griffin, Welch, Schofield-Gardiner",1.1 - Public Company (incl. Building Society),"Shepherd, Talbot, Griffin, Welch, Davis, Lawrence, Bibi, O'Connor-Dean PLC",20000727,0-632k,0-4 People,1,08-09-2018,0,27-01-2021,"[[7149, 100]]","[[7149, 100]]",N/A,N/A,United Kingdom,United Kingdom,0,211151,302.03,4242.02,4544.05,203755.5687,0-632k,6940,19885,117539,93880,28-12-2020,16113,19887,14082,211151,,,,,,,,,
728,Leeds,293 Liam plains Foxport LS27 8TT,00465-51-00-54,41-43 : Construction,"Mitchell, Knowles, Smith, Field, Fletcher",2 - Sole Proprietor,"Mitchell, Knowles, Smith, Field, Johnson, Price, Chapman, Porter-Edwards",20000728,0-632k,0-4 People,1,29-01-2017,1,08-04-2021,"[[9080, 100]]","[[9080, 100]]",N/A,N/A,United Kingdom,United Kingdom,0,344116,0.01,256499.76,256499.77,621817.612,0-632k,14141,42235,90604,36056,02-05-2021,9955,22267,8293,344116,,,,,,,,,
729,Vale of White Horse,Studio 58O Albert springs OX12 8ER,07903 85 13 07,49-53 : Transport & Storage (inc. postal),"Hawkins-Murray, Duncan, Kirk, Stewart, Hart, Jones, Anderson",2 - Sole Proprietor,"Hawkins-Murray, Duncan, Kirk, Stewart, Davies, Gardiner, Davis, Forster-Lewis",20000729,0-632k,0-4 People,2,01-01-2010,0,18-08-2021,"[[3013, 0], [2418, 0]]","[[8819, 100]]",N/A,N/A,United Kingdom,United Kingdom,1,91981,172.34,2406.97,2579.31,86909.42281,0-632k,2267,17584,53518,38419,12-05-2021,7116,4630,7683,91981,,,,,,,,,
730,East Hampshire,12 Jones trafficway Martinshire GU33 7JT,+44(0)168 1908952,77-82 : Business administration & support services,"Pugh, Murphy, Hughes, Gill, Abbott, Dawson, Smith",1.1 - Public Company (incl. Building Society),"Pugh, Murphy, Hughes, Gill, Griffin-Patel, Davies, Kaur and Winter Co",20000730,0-632k,0-4 People,2,20-11-2017,1,16-02-2020,"[[6882, 100], [4560, 0]]","[[6882, 100]]",N/A,N/A,United Kingdom,United Kingdom,1,330988,104.18,2188.73,2292.91,326781.3222,0-632k,15414,52628,113192,68377,20-12-2020,32998,25184,8205,330988,,,,,,,,,
731,Wiltshire,6 Lynne street Bakerstad BA14 8BS,+44(0)697 6864700,49-53 : Transport & Storage (inc. postal),"Byrne, Davies, Dawson-Jones, Wilkins-Whitehead Turnbull-Smith",1.1 - Public Company (incl. Building Society),"Byrne, Davies, Dawson-Jones, Wilkins-Whitehead PLC",20000731,0-632k,0-4 People,1,08-06-1990,1,13-08-2011,"[[8317, 0]]","[[1614, 100]]",N/A,N/A,United Kingdom,United Kingdom,1,100057,209.18,3268.42,3477.6,94628.63727,0-632k,2471,18992,56673,40429,19-05-2021,8817,6069,7277,100057,,,,,,,,,
732,Erewash,Flat 2 Kirk valley NG10 5ED,4725899420,47 : Retail,"Adams, Mitchell-Arnold, Bailey, Campbell, Johnston",2 - Sole Proprietor,"Adams, Mitchell-Arnold, Bailey, Campbell, Taylor, Spencer-Howells",20000732,0-632k,5-9 People,1,11-02-1988,1,30-11-2013,"[[2094, 100]]","[[2094, 100]]",N/A,N/A,United Kingdom,United Kingdom,0,641878,238.78,8205.58,8444.36,630795.3627,632k-1M,15828,19758,106991,71800,09-08-2021,4328,19760,13642,641878,,,,,,,,,
733,Harrow,Studio 93 Dean glens HA5 5BY,05515-01-95-22,68 : Property,"Turner, Khan, Brown, West-Roberts Brown",1.1 - Public Company (incl. Building Society),"Turner, Khan, Brown, West-Roberts LLC",20000733,0-632k,5-9 People,2,03-05-2017,1,11-07-2021,"[[6485, 75], [4327, 0]]","[[6485, 75], [5110, 25]]",N/A,N/A,United Kingdom,United Kingdom,1,466900,295.81,3546.84,3842.65,456213.5408,0-632k,0,867850,818864,817578,12-05-2021,1109690,243127,114460,466900,,,,,,,,,
734,South Northamptonshire,Studio 9 Graham overpass NN7 2LG,(0374) 1967943,45 : Motor trades,"Evans, Newman, Davies, Bishop-Turner, Peacock, Conway, Perry",1.1 - Public Company (incl. Building Society),"Evans, Newman, Davies, Bishop-Turner, Harrison-Wilson, Robertson Ltd",20000734,0-632k,0-4 People,1,27-07-2019,0,07-08-2021,"[[6916, 50]]","[[6916, 50], [2628, 50]]",N/A,N/A,United Kingdom,United Kingdom,1,297343,46.08,4702.31,4748.39,292051.781,0-632k,8146,66747,165437,144624,11-05-2021,72945,27011,31817,297343,,,,,,,,,
735,York,Flat 02B Khan hollow YO10 4EB,+44(0)1291260633,41-43 : Construction,"Smith, Marshall, Wilson, Richards, Lewis",1.1 - Public Company (incl. Building Society),"Smith, Marshall, Wilson, Richards, Lewis, Butler-Thompson Co",20000735,0-632k,5-9 People,3,28-08-2018,1,02-10-2020,"[[7687, 25], [7075, 75], [6556, 0]]","[[7687, 25], [7075, 75]]",N/A,N/A,United Kingdom,United Kingdom,0,1243816,168.51,5524.8,5693.31,1233932.643,1M-10.2M,51115,127979,272108,128904,16-05-2021,32604,47828,14179,1243816,,,,,,,,,
736,Moray,677 Antony trafficway Port Louisefurt IV32 7EF,02172 803857,"90-99 : Arts, entertainment, recreation & other","Hussain, Chapman, Butler, Graham, Brown-Gill",1.1 - Public Company (incl. Building Society),"Hussain, Chapman, Butler, Graham, Rogers-Cunningham, Little-Mitchell Ltd",20000736,0-632k,0-4 People,1,01-11-2017,1,11-10-2020,"[[1079, 25]]","[[1079, 25], [3342, 75]]",N/A,N/A,United Kingdom,United Kingdom,1,172706,0.01,80374.21,80374.22,156644.342,0-632k,8044,4373,59930,70267,20-10-2021,19087,4375,11945,172706,,,,,,,,,
737,Wandsworth,Flat 64 Lauren stream SW17 1GN,+44(0)187 5903733,77-82 : Business administration & support services,"Shah, Phillips-Morgan, McCarthy-Jones, Gardner, Franklin, Gill, Poole",2 - Sole Proprietor,"Shah, Phillips-Morgan, McCarthy-Jones, Gardner, Garner and Douglas",20000737,0-632k,0-4 People,2,28-06-2017,1,28-06-2021,"[[4453, 0], [2425, 100]]","[[2425, 100]]",N/A,N/A,United Kingdom,United Kingdom,1,340643,146.09,3624.96,3771.05,333923.8853,0-632k,15864,19876,128956,122733,15-09-2021,33530,19877,24546,340643,,,,,,,,,
738,Hammersmith and Fulham,Flat 08 Amanda ports W14 9XU,(0576)4815346,"69-75 : Professional, scientific & technical","Cooper-Hill, Lee, Carr, Smith, Bradshaw, Vincent, Morley",1.1 - Public Company (incl. Building Society),"Cooper-Hill, Lee, Carr, Smith, Jones-Davies, Brennan, Bartlett and Jackson LLC",20000738,0-632k,0-4 People,1,13-05-2012,1,06-11-2017,"[[7109, 75]]","[[7109, 75], [1025, 25]]",N/A,N/A,United Kingdom,United Kingdom,1,135993,0.01,10947.44,10947.45,21894.873,0-632k,6331,20624,42192,32024,22-04-2021,12084,1626,7045,135993,,,,,,,,,
739,St Albans,Studio 5 Albert gateway AL1 4SF,04410 38 70 85,"90-99 : Arts, entertainment, recreation & other","Brown, Turner, Patterson, Smith, Evans, Freeman, Smith",1.1 - Public Company (incl. Building Society),"Brown, Turner, Patterson, Smith, Franklin, Mason LLC",20000739,0-632k,0-4 People,1,13-08-2019,1,26-02-2021,"[[2944, 25]]","[[2944, 25], [5336, 75]]",N/A,N/A,United Kingdom,United Kingdom,0,178181,147.4,5047.86,5195.26,170693.8133,0-632k,8298,-2801,57994,79328,19-05-2021,15733,-2799,18245,178181,,,,,,,,,
740,Hillingdon,Studio 10N Olivia mountains UB8 3DR,04918 76006,"90-99 : Arts, entertainment, recreation & other","Morris-Green, Banks-Payne, Read, Cole, Barrett-Moran",7 - Non-profit Body or Mutual Association,"Morris-Green, Banks-Payne, Read, Cole, Phillips, Smith and Sons",20000740,0-632k,0-4 People,1,15-02-2013,1,01-03-2018,"[[2719, 75]]","[[2719, 75], [5678, 25]]",N/A,N/A,United Kingdom,United Kingdom,0,167164,102.87,3571.94,3674.81,159956.6989,0-632k,7787,-849,63860,80247,23-05-2021,14688,-847,11234,167164,,,,,,,,,
741,Calderdale,18 Joshua locks West Alexandra HX3 5SA,+44(0)138 1138761,86-88 : Health,"Davies-Winter, Smith, Holland, Jones, Tyler, Noble, Dawson",2 - Sole Proprietor,"Davies-Winter, Smith, Holland, Jones, Smith-Gray, Page, Marshall and Fleming",20000741,0-632k,0-4 People,1,03-02-2017,1,05-08-2021,"[[5475, 0]]","[[1636, 100]]",N/A,N/A,United Kingdom,United Kingdom,0,102654,0.02,4045.56,4045.58,12421.134,0-632k,4781,12249,27528,15613,14-05-2021,6497,6163,2498,102654,,,,,,,,,
742,East Suffolk,Studio 89v Mathew manors IP13 6TR,(0664)6331569,"69-75 : Professional, scientific & technical","Alexander-Goodwin, Stewart, Khan, Miles, Hope, Day, Phillips",1.1 - Public Company (incl. Building Society),"Alexander-Goodwin, Stewart, Khan, Miles, Murphy, Gould Co",20000742,0-632k,0-4 People,1,22-05-2018,1,02-11-2021,"[[8134, 50]]","[[8134, 50], [4627, 50]]",N/A,N/A,United Kingdom,United Kingdom,0,170167,0.01,31289.98,31289.99,82190.661,0-632k,7923,26848,52902,38474,16-04-2021,17750,5330,9618,170167,,,,,,,,,
743,West Berkshire,5 Manning plaza Thompsonshire RG31 7RP,+44344 4798268,05-39 : Production,"Baker-Swift, Harris, Leonard, Hunt, Smith-Watts",1.1 - Public Company (incl. Building Society),"Baker-Swift, Harris, Leonard, Hunt, Bishop, Smith, Howell and Ellis Ltd",20000743,0-632k,0-4 People,2,05-02-2006,1,22-03-2020,"[[1095, 50], [4043, 25]]","[[1095, 50], [4043, 25], [702, 25]]",N/A,N/A,United Kingdom,United Kingdom,1,231034,0.01,229088.86,229088.87,427643.934,0-632k,6962,46413,42346,42633,18-08-2021,102695,55995,5115,231034,,,,,,,,,
744,Glasgow City,12 Brett stravenue Paulineview G42 9AN,+44(0)395 635 8811,68 : Property,"White, Fry, Lewis, Kent, Scott",1.1 - Public Company (incl. Building Society),"White, Fry, Lewis, Kent, John, Freeman, Johnson, Heath-Stokes LLC",20000744,0-632k,0-4 People,1,14-09-2019,1,20-12-2020,"[[1441, 50]]","[[1441, 50], [3956, 50]]",N/A,N/A,United Kingdom,United Kingdom,1,253977,278.91,3417.96,3696.87,244786.4595,0-632k,0,446069,404237,347060,24-09-2021,587026,198135,38176,253977,,,,,,,,,
745,Selby,Studio 24B Elaine plaza LS25 6AY,+44(0)190 0013142,"90-99 : Arts, entertainment, recreation & other","Begum, Walton, Manning, Robinson-Garner, Cooper, Kelly, Wilkins",2 - Sole Proprietor,"Begum, Walton, Manning, Robinson-Garner, Bailey-Brown, Parry-Payne",20000745,0-632k,0-4 People,1,10-08-2003,1,12-03-2012,"[[4702, 0]]","[[4712, 100]]",N/A,N/A,United Kingdom,United Kingdom,0,62741,0.01,1728.79,1728.8,5395.726,0-632k,2918,498,19357,23473,30-03-2021,5114,500,4929,62741,,,,,,,,,
746,Blackburn with Darwen,740 Roger stream Sarahaven BB3 0NS,(0422) 5588959,47 : Retail,"Nicholls, Hill, Murray, Abbott-Adams, Morrison",1.1 - Public Company (incl. Building Society),"Nicholls, Hill, Murray, Abbott-Adams, Clark, Hudson, Bartlett, Walker, Chadwick and Fisher PLC",20000746,0-632k,0-4 People,1,15-08-2017,1,23-11-2021,"[[5951, 0]]","[[5056, 100]]",N/A,N/A,United Kingdom,United Kingdom,0,227789,141.52,4717.41,4858.93,222607.8797,0-632k,5617,16808,44520,27265,22-01-2021,2170,2616,2726,227789,,,,,,,,,
747,Great Yarmouth,Flat 0 Hughes island NR31 8PA,(0924)4208915,55-56 : Accommodation & food services,"Porter, Jones, Tyler, Freeman, Harris, Harris, Jones",1.1 - Public Company (incl. Building Society),"Porter, Jones, Tyler, Freeman, Atkinson, Nelson, Boyle and Saunders Co",20000747,0-632k,20-49 People,5,29-12-2010,1,11-09-2016,"[[9578, 25], [7881, 75], [8530, 0], [3125, 0], [3125, 0]]","[[9578, 25], [7881, 75]]",N/A,N/A,United Kingdom,United Kingdom,1,981737,0.03,948394.17,948394.2,1817195.187,632k-1M,26897,29775,374222,342387,20-05-2021,27717,29777,61629,981737,,,,,,,,,
748,Bath and North East Somerset,371 Grace oval Hewittside BA2 5BQ,+44(0)5841117065,"69-75 : Professional, scientific & technical","O'Neill-Wilson, Reeves, Hughes, Chapman Holt-Hughes",1.1 - Public Company (incl. Building Society),"O'Neill-Wilson, Reeves, Hughes, Chapman PLC",20000748,0-632k,5-9 People,2,21-01-1993,1,06-06-2014,"[[2119, 100], [4995, 0]]","[[2119, 100]]",N/A,N/A,United Kingdom,United Kingdom,0,1164714,0.02,574725.56,574725.58,967877.334,1M-10.2M,54253,235794,457789,374846,29-05-2021,162723,9870,93711,1164714,,,,,,,,,
749,Aberdeen City,Flat 00 Jones trafficway AB11 7SQ,+445280 88 97 41,"90-99 : Arts, entertainment, recreation & other","Cooper, Gibbs, Francis, Connor, Morris, Jackson, Williams",2 - Sole Proprietor,"Cooper, Gibbs, Francis, Connor, Edwards, Blackburn, Clarke, Porter, Phillips and Walsh",20000749,0-632k,0-4 People,1,23-02-2014,1,06-01-2021,"[[8624, 100]]","[[8624, 100]]",N/A,N/A,United Kingdom,United Kingdom,1,149781,132.99,4601.82,4734.81,141254.3805,0-632k,6976,3887,45805,48808,28-05-2021,10780,3889,7809,149781,,,,,,,,,
750,Chesterfield,Flat 6 French camp S41 0AD,4.42647E+11,58-63 : Information & communication,"Carter, Whittaker, Woods, Lees, Johnson",1.1 - Public Company (incl. Building Society),"Carter, Whittaker, Woods, Lees, Cook, Anderson, Leach, Brady, Stone and Williams Co",20000750,0-632k,0-4 People,1,08-05-2014,0,28-06-2020,"[[1441, 75]]","[[1441, 75], [7771, 25]]",N/A,N/A,United Kingdom,United Kingdom,1,149323,424.46,7486.04,7910.5,135185.0567,0-632k,4909,14771,98693,82903,18-12-2020,13754,14773,12435,149323,,,,,,,,,
751,Stirling,Flat 64T Jane manors FK9 4SH,02656 16 41 28,68 : Property,"Robinson-Taylor, Brown, Bell-Clark, Mistry-Palmer Cartwright, Clark, Sharp",3 - Partnership,"Robinson-Taylor, Brown, Bell-Clark, Mistry-Palmer GP",20000751,0-632k,0-4 People,1,25-01-2004,0,09-05-2012,"[[8684, 50]]","[[8684, 50], [5487, 50]]",N/A,N/A,United Kingdom,United Kingdom,0,277422,0.04,281847.13,281847.17,722129.466,0-632k,0,501887,418909,358183,06-05-2021,696397,255234,75218,277422,,,,,,,,,
752,Manchester,7 Cooper pine Smartmouth M22 5FE,+44(0)1406685767,49-53 : Transport & Storage (inc. postal),"Richardson-King, Allan, Mitchell, Smith, Watts, Wade, Hammond",1.1 - Public Company (incl. Building Society),"Richardson-King, Allan, Mitchell, Smith, Reed, Abbott and Sons Co",20000752,0-632k,0-4 People,2,03-11-2012,1,08-12-2020,"[[6226, 0], [672, 50]]","[[672, 50], [6617, 50]]",N/A,N/A,United Kingdom,United Kingdom,0,151372,203.7,2621.6,2825.3,146181.7503,0-632k,3733,31718,97667,68382,23-05-2021,11707,9273,17095,151372,,,,,,,,,
753,Burnley,648 Gillian well Westfurt BB12 8NP,+44(0)746 1830947,47 : Retail,"Harris, Morgan, Williams, Matthews, Owen-Fletcher",3 - Partnership,"Harris, Morgan, Williams, Matthews, Harrison, Begum-Smith LLP",20000753,0-632k,0-4 People,1,22-09-2019,1,03-11-2021,"[[4479, 100]]","[[4479, 100]]",N/A,N/A,United Kingdom,United Kingdom,1,264078,0.02,37883.94,37883.96,67868.046,0-632k,6510,7055,56958,44777,21-05-2021,1931,7057,9403,264078,,,,,,,,,
754,Burnley,Studio 46 Houghton islands BB12 8SN,+44(0)331 8714618,"01-03 : Agriculture, forestry & fishing","Walker, Wood, Parkinson, Allen-Poole, Hall-Randall",1.1 - Public Company (incl. Building Society),"Walker, Wood, Parkinson, Allen-Poole, Morgan, Burgess, Griffiths, Evans, Foster and West Co",20000754,0-632k,0-4 People,1,10-11-2014,1,08-02-2021,"[[344, 0]]","[[9007, 100]]",N/A,N/A,United Kingdom,United Kingdom,0,145061,507.28,4418.82,4926.1,137874.7622,0-632k,10332,163899,68837,44045,03-05-2021,223839,84732,6166,145061,,,,,,,,,
755,Torbay,536 Deborah shores Samshire TQ4 6LN,7712339484,55-56 : Accommodation & food services,"Barlow, Mason-Adams, Holland-Hussain, Wood Stevenson, Chapman, Mason",1.1 - Public Company (incl. Building Society),"Barlow, Mason-Adams, Holland-Hussain, Wood Ltd",20000755,0-632k,10-19 People,1,09-09-2019,1,24-05-2021,"[[805, 0]]","[[7306, 100]]",N/A,N/A,United Kingdom,United Kingdom,0,253054,0.03,92138.13,92138.16,197129.066,0-632k,6933,9176,105839,95500,28-03-2021,8015,9178,16235,253054,,,,,,,,,
756,Rushmoor,Flat 93a Cooper plains GU14 9PG,+442252 701361,41-43 : Construction,"Rowe, Wood, Crawford, Williams, Patterson-Rhodes",2 - Sole Proprietor,"Rowe, Wood, Crawford, Williams, Brown, Miller, Richards, Burgess-Nelson",20000756,0-632k,0-4 People,2,06-03-2019,1,02-10-2021,"[[9787, 0], [9369, 0]]","[[7143, 100]]",N/A,N/A,United Kingdom,United Kingdom,1,333151,0.01,27199.11,27199.12,54969.915,0-632k,13689,34407,72123,34064,21-05-2021,9797,13450,5450,333151,,,,,,,,,
757,South Hams,Flat 44l Fox corner TQ9 5UH,+44014 6674666,86-88 : Health,"Barker, Ross, Baker, Walton, Barnes, Allan, Mills",1.1 - Public Company (incl. Building Society),"Barker, Ross, Baker, Walton, Riley, Clements, Clarke, Cook Ltd",20000757,0-632k,0-4 People,1,23-06-2017,1,31-03-2018,"[[1838, 100]]","[[1838, 100]]",N/A,N/A,United Kingdom,United Kingdom,0,133519,217.65,2845.08,3062.73,124647.523,0-632k,6215,22511,50480,31651,16-12-2020,12051,8368,4747,133519,,,,,,,,,
