504,Maidstone,Studio 36 Lee garden ME15 7BE,+44(0)1316319139,68 : Property,"Marshall-Clark, Moore, Johnson-Ellis, Andrews-Miller O'Brien-Begum",1.1 - Public Company (incl. Building Society),"Marshall-Clark, Moore, Johnson-Ellis, Andrews-Miller Ltd",20000504,0-632k,0-4 People,1,13-04-2014,1,22-04-2021,"[[4953, 75]]","[[4953, 75], [8602, 25]]",N/A,N/A,United Kingdom,United Kingdom,0,360403,0.04,280625.06,280625.1,670709.983,0-632k,12836,652954,313417,258287,09-04-2021,1137591,539767,43908,360403,,,,,,,,,
505,Cambridge,Flat 58 Evans parkways CB4 1QZ,06703 29537,"69-75 : Professional, scientific & technical","Elliott, Scott, Thompson, Holland, Simmons",1.1 - Public Company (incl. Building Society),"Elliott, Scott, Thompson, Holland, Miller, Allen, Cox, Garner-Hancock PLC",20000505,632k-10.2M,10-19 People,1,24-08-2014,1,17-12-2017,"[[6129, 50]]","[[6129, 50], [1025, 50]]",N/A,N/A,United Kingdom,United Kingdom,1,2343949,481.2,17562.09,18043.29,2303314.817,1M-10.2M,109170,134629,787658,692283,13-05-2021,173885,134631,76151,2343949,,,,,,,,,
506,Cardiff,426 Hutchinson meadow Pearceberg CF11 8ZT,07763 00 17 42,58-63 : Information & communication,"White-Morris, Jones-North, Connor, Wright, Williamson, Hart, Phillips",1.1 - Public Company (incl. Building Society),"White-Morris, Jones-North, Connor, Wright, Taylor, Rhodes-Holmes LLC",20000506,0-632k,0-4 People,1,01-01-2019,1,06-05-2021,"[[7680, 100]]","[[7680, 100]]",N/A,N/A,United Kingdom,United Kingdom,0,221083,367.57,5140.8,5508.37,212128.4592,0-632k,7267,40308,116892,91241,20-04-2021,17469,2812,16423,221083,,,,,,,,,
507,Maidstone,Flat 24 Janice springs ME15 7HH,01150-58-05-58,46 : Wholesale,"Wallis-Quinn, Watkins-Wood, Sanders, Austin, Jones",1.1 - Public Company (incl. Building Society),"Wallis-Quinn, Watkins-Wood, Sanders, Austin, Taylor and Hammond Ltd",20000507,0-632k,0-4 People,2,03-06-2018,1,01-05-2020,"[[7640, 25], [6643, 0]]","[[7640, 25], [344, 75]]",N/A,N/A,United Kingdom,United Kingdom,0,868845,99.27,10233.51,10332.78,858852.3097,632k-1M,30945,53462,139662,71776,30-05-2021,13087,27510,16508,868845,,,,,,,,,
508,Newcastle upon Tyne,Studio 9 Dennis crossroad NE3 2UL,09816-33-80-46,77-82 : Business administration & support services,"Williams-Brown, George, Smith-Dixon, Browne-Smith Morris-Barker",1.1 - Public Company (incl. Building Society),"Williams-Brown, George, Smith-Dixon, Browne-Smith PLC",20000508,0-632k,5-9 People,1,27-12-2018,1,21-09-2021,"[[5542, 100]]","[[5542, 100]]",N/A,N/A,United Kingdom,United Kingdom,0,1130796,0.02,358841.71,358841.73,987184.908,1M-10.2M,52667,165050,372133,226503,27-12-2020,86339,66919,52095,1130796,,,,,,,,,
509,Sedgemoor,5 Ricky locks Dayhaven TA8 2RE,00726 99176,77-82 : Business administration & support services,"Cook, Shaw, Ward, Smith Harding",1.1 - Public Company (incl. Building Society),"Cook, Shaw, Ward, Smith LLC",20000509,0-632k,5-9 People,1,17-02-2019,1,30-11-2021,"[[6882, 25]]","[[6882, 25], [2354, 75]]",N/A,N/A,United Kingdom,United Kingdom,0,1264912,0.03,779551.1,779551.13,1601378.592,1M-10.2M,58912,194281,429728,254625,30-05-2021,109941,90762,53471,1264912,,,,,,,,,
510,Dorset,993 Tony lane New Stanley SP7 8GD,4.49864E+11,05-39 : Production,"Blake, Williams, Smith, Baker, Johnson-Morris",1.1 - Public Company (incl. Building Society),"Blake, Williams, Smith, Baker, Little, Cooper-Wade Ltd",20000510,632k-10.2M,10-19 People,1,24-04-2017,1,17-10-2021,"[[9563, 50]]","[[9563, 50], [7999, 50]]",N/A,N/A,United Kingdom,United Kingdom,0,2103881,783.02,30349.49,31132.51,2055973.364,1M-10.2M,63407,519177,588357,618120,25-05-2021,1034071,485131,142167,2103881,,,,,,,,,
511,Renfrewshire,312 Ellie motorway West Danielchester PA8 7AE,+44837 5194459,"90-99 : Arts, entertainment, recreation & other","Marsh, Perkins, Jackson, Jones, Taylor-Webb",1.1 - Public Company (incl. Building Society),"Marsh, Perkins, Jackson, Jones, Dodd and Jones LLC",20000511,0-632k,10-19 People,1,10-07-2018,1,05-05-2020,"[[4540, 50]]","[[4540, 50], [5987, 50]]",N/A,N/A,United Kingdom,United Kingdom,0,679232,0.01,57087.14,57087.15,164374.144,632k-1M,31635,17711,182089,190256,06-04-2021,43592,17713,38051,679232,,,,,,,,,
512,Slough,3 Jack mall North Valerie SL1 2YJ,+44(0)024 705 8767,49-53 : Transport & Storage (inc. postal),"Lee-Stephens, Ryan, Thomas, Johnson, Gregory, Williams, Lowe",1.1 - Public Company (incl. Building Society),"Lee-Stephens, Ryan, Thomas, Johnson, Lewis, Morgan, Martin, Collins and Sons PLC",20000512,632k-10.2M,0-4 People,1,06-02-2015,1,01-06-2021,"[[564, 75]]","[[564, 75], [6177, 25]]",N/A,N/A,United Kingdom,United Kingdom,1,190484,125.67,2177.96,2303.63,186526.2343,0-632k,4696,36846,114189,57391,17-04-2021,12868,32819,8034,190484,,,,,,,,,
513,Causeway Coast and Glens,573 Rosemary curve Deborahton BT51 3DH,05894-62-41-21,"01-03 : Agriculture, forestry & fishing","Baxter-Collins, Jones-Bird, Williams, Harris, Owen-Pearson",3 - Partnership,"Baxter-Collins, Jones-Bird, Williams, Harris, Stevens, Parker LP",20000513,0-632k,0-4 People,1,27-04-2015,1,10-06-2020,"[[4671, 50]]","[[4671, 50], [3603, 50]]",N/A,N/A,United Kingdom,United Kingdom,0,190234,303.3,2360.31,2663.61,186322.3109,0-632k,13550,209008,26275,15708,24-05-2021,346954,148512,2513,190234,,,,,,,,,
514,Haringey,Flat 2 Day wall N10 3RS,+44(0)759 4430308,47 : Retail,"Thompson, Wilkinson, Shah, Russell, Williamson-Scott",3 - Partnership,"Thompson, Wilkinson, Shah, Russell, Pritchard, Fowler, Walton, Patel, Griffiths and Wright GP",20000514,0-632k,5-9 People,1,29-12-2016,1,18-12-2020,"[[7421, 75]]","[[7421, 75], [8685, 25]]",N/A,N/A,United Kingdom,United Kingdom,0,809650,293.23,10146.36,10439.59,798933.5243,632k-1M,19963,16922,141936,113060,15-05-2021,4971,16924,12436,809650,,,,,,,,,
515,Buckinghamshire,Flat 6 Shirley river HP21 7EY,05463 59327,58-63 : Information & communication,"Lee, Thompson, Smart, Dickinson-Price, Hobbs",1.1 - Public Company (incl. Building Society),"Lee, Thompson, Smart, Dickinson-Price, Knight, Lee, Davies, Parsons Ltd",20000515,632k-10.2M,0-4 People,1,20-02-2016,1,23-10-2020,"[[3019, 25]]","[[3019, 25], [3495, 75]]",N/A,N/A,United Kingdom,United Kingdom,1,71700,428.75,6730.76,7159.51,60999.26225,0-632k,2357,435,41804,47057,12-04-2021,6126,437,9411,71700,,,,,,,,,
516,Dorset,57 Marsh stravenue Neilhaven DT2 8RD,+44(0)4841241740,45 : Motor trades,"Phillips, Williams, Woods-Lees, Haynes, Mason",2 - Sole Proprietor,"Phillips, Williams, Woods-Lees, Haynes, Holland and Parry",20000516,0-632k,0-4 People,1,28-06-2014,1,29-04-2017,"[[6908, 0]]","[[7342, 100]]",N/A,N/A,United Kingdom,United Kingdom,0,331535,58.3,5397.82,5456.12,324913.532,0-632k,9082,62831,168387,147087,03-05-2021,56009,14477,19121,331535,,,,,,,,,
517,Halton,94 Wallace freeway Lake Sally WA8 8LX,09247 06940,46 : Wholesale,"Smith-Hobbs, Davies, Fletcher-Hughes, Harvey-Preston Lewis",1.1 - Public Company (incl. Building Society),"Smith-Hobbs, Davies, Fletcher-Hughes, Harvey-Preston Co",20000517,0-632k,5-9 People,1,07-08-2018,1,28-09-2021,"[[6908, 100]]","[[6908, 100]]",N/A,N/A,United Kingdom,United Kingdom,0,2028280,111.17,10390.09,10501.26,2018312.53,1M-10.2M,72240,123335,318452,157280,05-09-2021,33934,71770,31456,2028280,,,,,,,,,
518,Horsham,Flat 6 Louis trace RH20 3HJ,00534 57 81 74,49-53 : Transport & Storage (inc. postal),"Fowler, Hall-Reynolds, Elliott-Walker, Page, Harris",2 - Sole Proprietor,"Fowler, Hall-Reynolds, Elliott-Walker, Page, Wright and Lawson",20000518,0-632k,5-9 People,1,16-05-2010,1,04-08-2020,"[[2043, 100]]","[[2043, 100]]",N/A,N/A,United Kingdom,United Kingdom,0,815201,528.48,8296.41,8824.89,800279.3954,632k-1M,20100,139805,423196,248476,27-09-2021,58891,93805,24847,815201,,,,,,,,,
519,Highland,Studio 2 Ford avenue IV12 4JF,(0737) 8385367,41-43 : Construction,"Wright, Kelly, Walters, Shaw, Hewitt-Barlow",3 - Partnership,"Wright, Kelly, Walters, Shaw, Matthews, O'Sullivan, Thomas, Wade-Williams GP",20000519,0-632k,0-4 People,2,26-10-2008,1,18-08-2019,"[[8577, 25], [4585, 0]]","[[8577, 25], [6854, 75]]",N/A,N/A,United Kingdom,United Kingdom,0,351275,125.58,4421.71,4547.29,343143.8748,0-632k,14437,37562,80723,39734,29-04-2021,8710,12137,4768,351275,,,,,,,,,
520,Hambleton,1 Hilary trafficway Johnsonton DL7 8SP,+443832 542692,"01-03 : Agriculture, forestry & fishing","Stephenson, Haynes-Marshall, Johnson, Williams, Atkinson, Knight, Harper",3 - Partnership,"Stephenson, Haynes-Marshall, Johnson, Williams, Scott, Chapman, Gordon and Webb LP",20000520,0-632k,5-9 People,1,08-07-2014,1,02-01-2018,"[[3460, 100]]","[[3460, 100]]",N/A,N/A,United Kingdom,United Kingdom,0,1130876,0.05,215206.61,215206.66,389021.344,1M-10.2M,80560,1209351,421545,312402,17-10-2021,1738010,637802,43736,1130876,,,,,,,,,
521,Redbridge,Studio 67 Lucy prairie IG3 8LZ,+449585 12 40 12,47 : Retail,"Haynes, Matthews, Williams, Johnson-Leonard, Noble, Cox, Reed",1.1 - Public Company (incl. Building Society),"Haynes, Matthews, Williams, Johnson-Leonard, Taylor-Fry, Robinson, Hunter and Gardiner Inc",20000521,0-632k,0-4 People,1,05-07-2014,1,15-04-2018,"[[8674, 75]]","[[8674, 75], [2462, 25]]",N/A,N/A,United Kingdom,United Kingdom,0,202788,109.08,4544.87,4653.95,196425.3129,0-632k,5000,4120,35258,28604,13-05-2021,1588,4122,2860,202788,,,,,,,,,
522,North Kesteven,987 Power dale Malcolmside NG34 8WG,+44(0)594 383 4131,47 : Retail,"Ward, Graham, Fry, Allen, Tucker",1.1 - Public Company (incl. Building Society),"Ward, Graham, Fry, Allen, Brown, Stanley, Bailey, Hewitt-Simpson Co",20000522,0-632k,5-9 People,1,29-07-2018,1,19-11-2020,"[[5195, 0]]","[[5521, 100]]",N/A,N/A,United Kingdom,United Kingdom,0,597704,289.07,10360.86,10649.93,584239.5945,0-632k,14737,14856,111459,87305,29-04-2021,5560,14858,21826,597704,,,,,,,,,
523,Highland,60 Dodd springs East Naomiberg IV2 3EZ,09908 44 51 66,47 : Retail,"O'Donnell, Edwards, Fletcher, Morris, Wood",1.1 - Public Company (incl. Building Society),"O'Donnell, Edwards, Fletcher, Morris, Bishop, Dunn-Hunt Inc",20000523,632k-10.2M,10-19 People,1,23-06-2015,1,09-04-2021,"[[8658, 50]]","[[8658, 50], [3328, 50]]",N/A,N/A,United Kingdom,United Kingdom,0,1738934,599.48,24772.04,25371.52,1702706.978,1M-10.2M,42877,28812,294755,248951,07-12-2020,11821,28813,49790,1738934,,,,,,,,,
524,Wiltshire,Studio 68e Gail pass SP3 6LR,00166 39 25 45,55-56 : Accommodation & food services,"Price-Akhtar, Lloyd-Robinson, Sharp-Wilson, Slater Alexander-Young",2 - Sole Proprietor,"Price-Akhtar, Lloyd-Robinson, Sharp-Wilson, Slater",20000524,632k-10.2M,20-49 People,6,26-08-2008,1,29-07-2020,"[[6904, 100], [8371, 0], [7467, 0], [6089, 0], [354, 0], [0, 0]]","[[6904, 100]]",N/A,N/A,United Kingdom,United Kingdom,1,1242786,0.04,72350.53,72350.57,125521.386,1M-10.2M,34049,16557,443385,455451,01-05-2021,45182,16558,91090,1242786,,,,,,,,,
525,Brentwood,Studio 20 Smith streets CM15 0QT,(0736)5650629,"90-99 : Arts, entertainment, recreation & other","Sinclair, Thompson-Hussain, May, Knowles, Simpson",1.1 - Public Company (incl. Building Society),"Sinclair, Thompson-Hussain, May, Knowles, Lee, Skinner-Griffiths LLC",20000525,0-632k,5-9 People,1,24-02-2018,1,21-02-2021,"[[9405, 75]]","[[9405, 75], [1614, 25]]",N/A,N/A,United Kingdom,United Kingdom,1,248165,0.01,15487.56,15487.57,37472.915,0-632k,11558,-2865,83415,116872,07-03-2021,27728,-2863,14024,248165,,,,,,,,,
526,Wealden,92 Beth drive Patriciaberg BN20 9NX,03275 11470,86-88 : Health,"Gray, Schofield, Martin, Griffiths-Ellis, Jones, Daly, Talbot",2 - Sole Proprietor,"Gray, Schofield, Martin, Griffiths-Ellis, Cartwright, Evans, Ashton, Nelson-Baldwin",20000526,0-632k,0-4 People,2,31-07-2004,1,15-02-2021,"[[2949, 100], [59, 0]]","[[2949, 100]]",N/A,N/A,United Kingdom,United Kingdom,1,145661,219.39,3279.41,3498.8,135054.8735,0-632k,6785,9281,46686,41492,09-08-2021,13371,9283,8713,145661,,,,,,,,,
527,Salford,653 Michael shores Whiteborough M7 4SB,(0086) 9950859,47 : Retail,"Gilbert, Bennett, Jackson, Owen, Smith, Brown, Scott",1.1 - Public Company (incl. Building Society),"Gilbert, Bennett, Jackson, Owen, Ellis, Gibbs LLC",20000527,0-632k,0-4 People,1,28-04-2018,1,30-06-2021,"[[5954, 0]]","[[8630, 100]]",N/A,N/A,United Kingdom,United Kingdom,0,134179,139.73,4339.48,4479.21,129143.0439,0-632k,3309,2791,21491,16972,06-01-2021,1066,2793,3224,134179,,,,,,,,,
528,Epping Forest,10 Geraldine road Charlieville IG7 5AY,(0589)5582597,05-39 : Production,"O'Connor-Roberts, Howe, Simpson, Smith, Woodward",3 - Partnership,"O'Connor-Roberts, Howe, Simpson, Smith, Griffin, Dean, Robson, Allan, Clayton and Reynolds LLP",20000528,0-632k,0-4 People,1,12-11-2005,1,01-10-2015,"[[1197, 0]]","[[5521, 100]]",N/A,N/A,United Kingdom,United Kingdom,0,242806,0.01,10823.66,10823.67,28893.914,0-632k,7318,55799,84856,73288,05-01-2021,89515,45284,17589,242806,,,,,,,,,
529,West Berkshire,Flat 6 Taylor village RG7 1LT,09361-82-12-63,55-56 : Accommodation & food services,"Murphy, Reynolds, Lewis, Smith, Bradley, Brown, Green",1.1 - Public Company (incl. Building Society),"Murphy, Reynolds, Lewis, Smith, Gill, Hunt, Knowles, Pearce, Walker, Russell-Patel Inc",20000529,0-632k,5-9 People,1,06-12-2019,1,08-10-2021,"[[4284, 0]]","[[8082, 100]]",N/A,N/A,United Kingdom,United Kingdom,0,326787,574.85,7018.88,7593.73,313307.2951,0-632k,8953,10560,123187,113057,30-05-2021,10991,10562,28264,326787,,,,,,,,,
530,Wiltshire,556 Mathew turnpike East Shannonborough SP5 1SA,(0679)7097379,"01-03 : Agriculture, forestry & fishing","Grant, Lowe, Campbell, Naylor, Page",2 - Sole Proprietor,"Grant, Lowe, Campbell, Naylor, Dixon, Taylor, Adams-Byrne, Moore",20000530,0-632k,0-4 People,1,10-07-2018,1,05-01-2021,"[[6617, 100]]","[[6617, 100]]",N/A,N/A,United Kingdom,United Kingdom,0,196937,465.75,4356.86,4822.61,190530.8003,0-632k,14030,129432,44746,28964,11-04-2021,186382,72732,2896,196937,,,,,,,,,
531,Solihull,4 Hughes turnpike South Alan CV7 7SA,07014 51555,"69-75 : Professional, scientific & technical","Reynolds-Evans, Saunders, Martin-Bennett, Murphy, Edwards, Stephenson, Welch",1.1 - Public Company (incl. Building Society),"Reynolds-Evans, Saunders, Martin-Bennett, Murphy, Collins and Taylor PLC",20000531,632k-10.2M,10-19 People,1,17-02-2006,1,20-09-2012,"[[970, 50]]","[[970, 50], [344, 50]]",N/A,N/A,United Kingdom,United Kingdom,0,1428234,0.01,1018935.27,1018935.28,1909548.858,1M-10.2M,66518,95056,493902,429122,17-12-2020,125333,95057,77242,1428234,,,,,,,,,
532,Welwyn Hatfield,Studio 2 Chandler ferry AL7 4TN,+447668 47 31 19,"69-75 : Professional, scientific & technical","Kelly-Spencer, Sheppard, Wright-James, James-Bennett Ryan-Smith",1.1 - Public Company (incl. Building Society),"Kelly-Spencer, Sheppard, Wright-James, James-Bennett Inc",20000532,0-632k,0-4 People,2,13-06-2018,1,09-07-2021,"[[1112, 25], [6882, 50]]","[[1112, 25], [6882, 50], [3030, 25]]",N/A,N/A,United Kingdom,United Kingdom,1,211275,63.45,2080.25,2143.7,205539.535,0-632k,9841,33622,67457,40754,16-05-2021,21023,14103,6520,211275,,,,,,,,,
533,Winchester,07 Tony court Bradleyburgh SO23 7JP,(0106) 9256210,"69-75 : Professional, scientific & technical","Talbot-Jones, Robinson, Singh, Haynes, Frost",1.1 - Public Company (incl. Building Society),"Talbot-Jones, Robinson, Singh, Haynes, Watson, Myers, Walker, Simpson, Evans and Moran PLC",20000533,0-632k,0-4 People,1,07-07-2019,1,02-08-2021,"[[5542, 100]]","[[5542, 100]]",N/A,N/A,United Kingdom,United Kingdom,0,193903,0.01,24494.21,24494.22,47506.235,0-632k,9031,15462,67045,55516,16-08-2021,19397,15464,5551,193903,,,,,,,,,
534,"Kingston upon Hull, City of",Flat 05p Toby orchard HU8 9UA,4.46272E+11,41-43 : Construction,"Jones, Turner-Harrison, Owens, Barlow, Rogers, Ashton, Atkinson",1.1 - Public Company (incl. Building Society),"Jones, Turner-Harrison, Owens, Barlow, Coates, Hancock, Parkinson and Banks Co",20000534,0-632k,0-4 People,1,16-05-2006,1,20-01-2016,"[[7075, 0]]","[[6120, 100]]",N/A,N/A,United Kingdom,United Kingdom,0,351826,118.57,4145.67,4264.24,344807.7645,0-632k,14454,35623,77607,33587,10-05-2021,7209,15606,7053,351826,,,,,,,,,
535,East Staffordshire,Flat 62 Tony track DE15 0DU,09967 69088,47 : Retail,"Saunders, Gilbert, Holden, Chapman, Williams",1.1 - Public Company (incl. Building Society),"Saunders, Gilbert, Holden, Chapman, Johnson and Bennett Inc",20000535,0-632k,0-4 People,2,05-07-2008,1,23-03-2016,"[[635, 25], [4293, 0]]","[[635, 25], [3813, 75]]",N/A,N/A,United Kingdom,United Kingdom,0,240666,187.11,5958.84,6145.95,233437.9031,0-632k,5934,3989,43678,37763,05-03-2021,2063,3990,4531,240666,,,,,,,,,
536,Islington,Flat 72 Lynda gardens EC1M 6BW,+449450 787941,41-43 : Construction,"Hall, Watson, Horton, Miah, Turnbull",1.1 - Public Company (incl. Building Society),"Hall, Watson, Horton, Miah, James, Graham-Hanson Ltd",20000536,0-632k,5-9 People,1,14-10-2012,1,11-02-2016,"[[8574, 25]]","[[8574, 25], [5231, 75]]",N/A,N/A,United Kingdom,United Kingdom,1,730083,312.33,10696.25,11008.58,715123.2096,632k-1M,30003,67360,146043,77646,26-05-2021,14338,15374,14752,730083,,,,,,,,,
537,Telford and Wrekin,Flat 45N Banks drive TF2 7EQ,08199 04521,45 : Motor trades,"Fry, Brooks, Bates, Morton, Anderson",1.1 - Public Company (incl. Building Society),"Fry, Brooks, Bates, Morton, Griffiths, King, Wright, Campbell, Allen and Reed Co",20000537,0-632k,0-4 People,3,07-07-2016,1,14-10-2017,"[[3065, 75], [4355, 25], [6117, 0]]","[[3065, 75], [4355, 25]]",N/A,N/A,United Kingdom,United Kingdom,0,231800,106.26,9240.17,9346.43,222137.5812,0-632k,6350,41476,101647,81051,12-05-2021,46483,25603,13778,231800,,,,,,,,,
538,Sunderland,Studio 25i Sam camp SR3 1PE,(0722) 6096962,"90-99 : Arts, entertainment, recreation & other","Hughes-Green, Hamilton, Cooper, Adams, Harrison, Lloyd, Hughes",1.1 - Public Company (incl. Building Society),"Hughes-Green, Hamilton, Cooper, Adams, Brown, Andrews-Chadwick LLC",20000538,0-632k,0-4 People,1,13-12-2019,1,29-09-2020,"[[3409, 25]]","[[3409, 25], [4864, 75]]",N/A,N/A,United Kingdom,United Kingdom,0,152661,180.54,5389.18,5569.72,144831.3109,0-632k,7109,4246,47365,55136,30-12-2020,16266,4248,5513,152661,,,,,,,,,
539,Woking,Flat 47N Williams harbors GU21 8YS,+449147 12 94 03,"69-75 : Professional, scientific & technical","Simmons, McCarthy, Smith, Wright, John-Morris",1.1 - Public Company (incl. Building Society),"Simmons, McCarthy, Smith, Wright, Reynolds-Phillips, Griffiths PLC",20000539,0-632k,0-4 People,2,09-02-2019,0,08-05-2021,"[[970, 75], [5542, 25]]","[[970, 75], [5542, 25]]",N/A,N/A,United Kingdom,United Kingdom,0,177254,154.84,5093.44,5248.28,166113.499,0-632k,8254,24810,49950,39633,27-05-2021,15340,847,7926,177254,,,,,,,,,
540,Basildon,Flat 66 Natalie place SS11 8EG,02788-80-45-70,"69-75 : Professional, scientific & technical","Singh-Dawson, Hartley, Kaur, Jones, Robinson-Middleton",1.1 - Public Company (incl. Building Society),"Singh-Dawson, Hartley, Kaur, Jones, Robertson, Robinson, Hayward and Phillips LLC",20000540,0-632k,0-4 People,1,25-06-2019,1,27-06-2021,"[[2425, 0]]","[[6381, 100]]",N/A,N/A,United Kingdom,United Kingdom,1,82902,83.51,3450.82,3534.33,73689.9913,0-632k,3860,4744,27449,25212,11-02-2021,7252,4746,4790,82902,,,,,,,,,
541,Waltham Forest,27 Abbott fields Duncanchester E4 7SG,07379-86-75-11,85 : Education,"Yates-Hunter, Carroll-Bell, Gallagher, Howells, Allan-Fry",1.1 - Public Company (incl. Building Society),"Yates-Hunter, Carroll-Bell, Gallagher, Howells, Bond, Jones LLC",20000541,0-632k,0-4 People,1,29-03-2012,1,15-04-2019,"[[6859, 0]]","[[4371, 100]]",N/A,N/A,United Kingdom,United Kingdom,0,156085,412.22,2409.23,2821.45,151220.8067,0-632k,7269,17837,45174,28282,24-05-2021,14284,13339,2828,156085,,,,,,,,,
542,Bolsover,1 Mistry course Jacquelineton DE55 6JQ,09851 92644,77-82 : Business administration & support services,"Yates, Jones-Davey, James-Lee, Richardson, Powell",2 - Sole Proprietor,"Yates, Jones-Davey, James-Lee, Richardson, John and Campbell",20000542,0-632k,5-9 People,1,27-03-2019,1,24-05-2021,"[[5987, 100]]","[[5987, 100]]",N/A,N/A,United Kingdom,United Kingdom,0,997493,333.62,5560.34,5893.96,985360.4655,632k-1M,46462,61696,296655,270716,09-05-2021,97456,61698,43314,997493,,,,,,,,,
543,Barnet,35 Clive mews Hughview HA8 7NB,09868-46-58-20,58-63 : Information & communication,"Harrison, Sullivan, Gray, Holt, Dunn-Ward",1.1 - Public Company (incl. Building Society),"Harrison, Sullivan, Gray, Holt, Thomas-James, Ryan LLC",20000543,0-632k,0-4 People,1,26-04-2009,1,26-07-2018,"[[1441, 100]]","[[1441, 100]]",N/A,N/A,United Kingdom,United Kingdom,1,134949,222.51,3973.33,4195.84,128435.3375,0-632k,4436,23176,67975,46503,03-05-2021,9279,7575,5580,134949,,,,,,,,,
544,Oadby and Wigston,Studio 53h Edward highway LE2 4DQ,+444062 430416,64-66 : Finance & insurance,"Ahmed, Gregory, Duncan, Hayes, Preston-Harper",1.1 - Public Company (incl. Building Society),"Ahmed, Gregory, Duncan, Hayes, Price-Smith, Marshall Inc",20000544,0-632k,0-4 People,3,16-01-2011,1,24-04-2016,"[[4466, 0], [4466, 75], [3129, 25]]","[[4466, 75], [3129, 25]]",N/A,N/A,United Kingdom,United Kingdom,1,,,,,,,,,,,,,,,,,,,,,,,,
545,Liverpool,190 Clark common Armstrongshire L7 0JY,01640-59-66-23,"90-99 : Arts, entertainment, recreation & other","Connolly-Stephenson, Turner-Pickering, Jones-Dickinson, Wade, Pickering-Peacock",1.1 - Public Company (incl. Building Society),"Connolly-Stephenson, Turner-Pickering, Jones-Dickinson, Wade, Collier and Wilson Co",20000545,0-632k,0-4 People,1,12-04-2016,1,20-07-2020,"[[4682, 0]]","[[4671, 100]]",N/A,N/A,United Kingdom,United Kingdom,0,150521,200.19,5703.44,5903.63,142289.7429,0-632k,7009,923,48958,58997,09-05-2021,11886,925,11209,150521,,,,,,,,,
546,Hounslow,Flat 68V Roger well W4 4EH,03265 98 32 95,58-63 : Information & communication,"Wallace, Charlton, Miller, Patel, Ellis",1.1 - Public Company (incl. Building Society),"Wallace, Charlton, Miller, Patel, Grant, Cunningham, Clark and Moore Co",20000546,0-632k,5-9 People,1,26-07-2014,1,06-09-2020,"[[3129, 0]]","[[8038, 100]]",N/A,N/A,United Kingdom,United Kingdom,0,709937,0.02,5566.4,5566.42,16328.551,632k-1M,23340,178302,541647,406353,17-05-2021,52694,9685,65016,709937,,,,,,,,,
547,Barking and Dagenham,160 Ian lodge Port Barbaramouth IG11 0AS,00310 90545,77-82 : Business administration & support services,"Hutchinson, Dunn, Woodward, Thompson, Kelly, Payne, Scott",1.1 - Public Company (incl. Building Society),"Hutchinson, Dunn, Woodward, Thompson, Murray, Simpson, Smith and Hill PLC",20000547,632k-10.2M,0-4 People,1,02-10-1964,1,18-08-2001,"[[7837, 25]]","[[7837, 25], [6972, 75]]",N/A,N/A,United Kingdom,United Kingdom,0,311425,95.78,1780.21,1875.99,306889.4387,0-632k,14503,39644,90692,57820,06-05-2021,19429,12657,6360,311425,,,,,,,,,
548,Newport,653 Russell oval New Howardborough NP19 7PJ,+44(0)2862718226,"69-75 : Professional, scientific & technical","McDonald, Hughes, Alexander, Ross-Hunt, Burke",1.1 - Public Company (incl. Building Society),"McDonald, Hughes, Alexander, Ross-Hunt, Morris-Harrison, O'Brien, Baxter and White Ltd",20000548,0-632k,0-4 People,1,22-02-2019,1,10-09-2021,"[[970, 25]]","[[970, 25], [8958, 75]]",N/A,N/A,United Kingdom,United Kingdom,1,103392,77.2,2617,2694.2,97553.09196,0-632k,4816,6519,26414,22070,28-05-2021,8698,6521,3752,103392,,,,,,,,,
549,Southampton,3 Welch cape South Beverleyborough SO19 8NG,03515 409897,"90-99 : Arts, entertainment, recreation & other","Stevens, Booth, Taylor, Hamilton, Jones-Hutchinson",2 - Sole Proprietor,"Stevens, Booth, Taylor, Hamilton, Young, Brown-Jones",20000549,0-632k,5-9 People,1,25-08-2016,1,23-02-2019,"[[5535, 0]]","[[3543, 100]]",N/A,N/A,United Kingdom,United Kingdom,0,403116,0.02,2632.63,2632.65,4434.276,0-632k,18776,-11310,164083,223681,19-05-2021,36979,-11308,33552,403116,,,,,,,,,
550,County Durham,Flat 3 Ann fork DH1 4TZ,(0997)2787651,77-82 : Business administration & support services,"Chapman, Wells, Stevens, Griffiths, Gill",2 - Sole Proprietor,"Chapman, Wells, Stevens, Griffiths, Hall, Lewis, Harding, Thorpe-Palmer",20000550,0-632k,10-19 People,1,10-10-2008,1,26-04-2021,"[[2425, 0]]","[[5623, 100]]",N/A,N/A,United Kingdom,United Kingdom,0,2252986,1343.38,24292.63,25636.01,2203540.388,1M-10.2M,104935,365274,811965,533011,05-04-2021,202686,116366,58631,2252986,,,,,,,,,
551,Bromley,Flat 07 Hayes common BR7 5SG,+44(0)846 2159711,47 : Retail,"Coates, Walker, King, Rose, Jones",1.1 - Public Company (incl. Building Society),"Coates, Walker, King, Rose, Scott, Walker, Harris, Hancock, Crawford and Cox Ltd",20000551,0-632k,0-4 People,1,27-09-1959,1,26-09-2001,"[[1221, 25]]","[[1221, 25], [2782, 75]]",N/A,N/A,United Kingdom,United Kingdom,0,182904,160.2,4854.45,5014.65,175627.0528,0-632k,4510,5197,35669,26774,17-03-2021,1501,5199,4283,182904,,,,,,,,,
552,Aberdeenshire,16 Schofield stream Daviesview AB45 2NH,+44996 2204964,"69-75 : Professional, scientific & technical","Turner-Bolton, Barrett, Sharpe, Dickinson, Wood",1.1 - Public Company (incl. Building Society),"Turner-Bolton, Barrett, Sharpe, Dickinson, Miller and Bruce Ltd",20000552,0-632k,0-4 People,2,13-06-2007,1,19-08-2018,"[[4466, 25], [724, 0]]","[[4466, 25], [138, 75]]",N/A,N/A,United Kingdom,United Kingdom,1,70119,94.42,2941.37,3035.79,62285.79702,0-632k,3265,12156,25038,16264,12-04-2021,6953,3570,4066,70119,,,,,,,,,
553,Bradford,94 Susan loop Hortonchester BD9 4EW,4.40527E+11,"01-03 : Agriculture, forestry & fishing","Yates, Bolton, Bennett, Williams, Wright",2 - Sole Proprietor,"Yates, Bolton, Bennett, Williams, Stokes, Jones, Andrews, Harper",20000553,0-632k,0-4 People,1,27-04-2008,1,02-11-2016,"[[6177, 0]]","[[7758, 100]]",N/A,N/A,United Kingdom,United Kingdom,0,198931,0.05,4119.28,4119.33,10543.343,0-632k,14159,220315,61688,51947,16-05-2021,331732,121157,11428,198931,,,,,,,,,
